accession	genbank_accession_rev	strain	date	region	country	division	location	host	date_submitted	sra_accession	abbr_authors	authors	institution	clade	G_clade	qc.overallScore	qc.overallStatus	alignmentScore	alignmentStart	alignmentEnd	genome_coverage	G_coverage	F_coverage	num_date
OQ595262	OQ595262.1	Kilifi/RSVA/HF20032_12/03/2018	2018-03-12	Africa	Kenya	Kilifi		Homo sapiens	2023-04-15		Lambisia et al.	Lambisia,A.W.,Lewa,C.,Mutunga,M.,Cheruiyot,R.,Okanda,D.,Makori,T.,Githinji,G.,Nokes,J.D.,Agoti,C.	KEMRI-Wellcome Trust, Epidemiology and Demography	A.D.2.2	GA2.3.5	0.0	good	43623	236	15014	0.9686042692939244	1.0	1.0	2018.1931506849314
OQ595266	OQ595266.1	Kilifi/RSVA/HF20036_13/03/2018	2018-03-13	Africa	Kenya	Kilifi		Homo sapiens	2023-04-15		Lambisia et al.	Lambisia,A.W.,Lewa,C.,Mutunga,M.,Cheruiyot,R.,Okanda,D.,Makori,T.,Githinji,G.,Nokes,J.D.,Agoti,C.	KEMRI-Wellcome Trust, Epidemiology and Demography	A.D.4	GA2.3.5	0.0	good	43372	236	15014	0.9685385878489328	1.0	1.0	2018.195890410959
OQ595276	OQ595276.1	Kilifi/RSVA/HF20046_23/03/2018	2018-03-23	Africa	Kenya	Kilifi		Homo sapiens	2023-04-15		Lambisia et al.	Lambisia,A.W.,Lewa,C.,Mutunga,M.,Cheruiyot,R.,Okanda,D.,Makori,T.,Githinji,G.,Nokes,J.D.,Agoti,C.	KEMRI-Wellcome Trust, Epidemiology and Demography	A.D.4	GA2.3.5	0.0	good	43405	236	15014	0.9686042692939244	1.0	1.0	2018.2232876712328
OQ595273	OQ595273.1	Kilifi/RSVA/HF20043_21/03/2018	2018-03-21	Africa	Kenya	Kilifi		Homo sapiens	2023-04-15		Lambisia et al.	Lambisia,A.W.,Lewa,C.,Mutunga,M.,Cheruiyot,R.,Okanda,D.,Makori,T.,Githinji,G.,Nokes,J.D.,Agoti,C.	KEMRI-Wellcome Trust, Epidemiology and Demography	A.D	GA2.3.5	0.0	good	43592	236	15014	0.9686042692939244	1.0	1.0	2018.217808219178
OQ595280	OQ595280.1	Kilifi/RSVA/HF20050_29/03/2018	2018-03-29	Africa	Kenya	Kilifi		Homo sapiens	2023-04-15		Lambisia et al.	Lambisia,A.W.,Lewa,C.,Mutunga,M.,Cheruiyot,R.,Okanda,D.,Makori,T.,Githinji,G.,Nokes,J.D.,Agoti,C.	KEMRI-Wellcome Trust, Epidemiology and Demography	A.D.4	GA2.3.5	0.0	good	43361	235	15014	0.9686042692939244	1.0	1.0	2018.2397260273972
OQ595284	OQ595284.1	Kilifi/RSVA/HF20054_04/04/2018	2018-04-04	Africa	Kenya	Kilifi		Homo sapiens	2023-04-15		Lambisia et al.	Lambisia,A.W.,Lewa,C.,Mutunga,M.,Cheruiyot,R.,Okanda,D.,Makori,T.,Githinji,G.,Nokes,J.D.,Agoti,C.	KEMRI-Wellcome Trust, Epidemiology and Demography	A.D.4	GA2.3.5	0.0	good	43367	236	15014	0.9686042692939244	1.0	1.0	2018.2561643835616
OQ595288	OQ595288.1	Kilifi/RSVA/HF20058_06/04/2018	2018-04-06	Africa	Kenya	Kilifi		Homo sapiens	2023-04-15		Lambisia et al.	Lambisia,A.W.,Lewa,C.,Mutunga,M.,Cheruiyot,R.,Okanda,D.,Makori,T.,Githinji,G.,Nokes,J.D.,Agoti,C.	KEMRI-Wellcome Trust, Epidemiology and Demography	A.D.4	GA2.3.5	56.25	mediocre	43365	236	15014	0.9686699507389164	1.0	1.0	2018.2616438356165
OQ595298	OQ595298.1	Kilifi/RSVA/HF20068_15/04/2018	2018-04-15	Africa	Kenya	Kilifi		Homo sapiens	2023-04-15		Lambisia et al.	Lambisia,A.W.,Lewa,C.,Mutunga,M.,Cheruiyot,R.,Okanda,D.,Makori,T.,Githinji,G.,Nokes,J.D.,Agoti,C.	KEMRI-Wellcome Trust, Epidemiology and Demography	A.D	GA2.3.5	0.0	good	43431	236	15014	0.9686699507389164	1.0	1.0	2018.286301369863
OQ595299	OQ595299.1	Kilifi/RSVA/HF20069_15/04/2018	2018-04-15	Africa	Kenya	Kilifi		Homo sapiens	2023-04-15		Lambisia et al.	Lambisia,A.W.,Lewa,C.,Mutunga,M.,Cheruiyot,R.,Okanda,D.,Makori,T.,Githinji,G.,Nokes,J.D.,Agoti,C.	KEMRI-Wellcome Trust, Epidemiology and Demography	A.D.2.2	GA2.3.5	0.0	good	43667	236	15014	0.9686042692939244	1.0	1.0	2018.286301369863
OQ595303	OQ595303.1	Kilifi/RSVA/HF20073_20/04/2018	2018-04-20	Africa	Kenya	Kilifi		Homo sapiens	2023-04-15		Lambisia et al.	Lambisia,A.W.,Lewa,C.,Mutunga,M.,Cheruiyot,R.,Okanda,D.,Makori,T.,Githinji,G.,Nokes,J.D.,Agoti,C.	KEMRI-Wellcome Trust, Epidemiology and Demography	A.D.4	GA2.3.5	0.0	good	43373	236	15014	0.9686699507389164	1.0	1.0	2018.3
OQ595307	OQ595307.1	Kilifi/RSVA/HF20077_27/04/2018	2018-04-27	Africa	Kenya	Kilifi		Homo sapiens	2023-04-15		Lambisia et al.	Lambisia,A.W.,Lewa,C.,Mutunga,M.,Cheruiyot,R.,Okanda,D.,Makori,T.,Githinji,G.,Nokes,J.D.,Agoti,C.	KEMRI-Wellcome Trust, Epidemiology and Demography	A.D.5	GA2.3.5	0.0	good	43442	236	15014	0.9686699507389164	1.0	1.0	2018.3191780821917
OQ595308	OQ595308.1	Kilifi/RSVA/HF20078_26/04/2018	2018-04-26	Africa	Kenya	Kilifi		Homo sapiens	2023-04-15		Lambisia et al.	Lambisia,A.W.,Lewa,C.,Mutunga,M.,Cheruiyot,R.,Okanda,D.,Makori,T.,Githinji,G.,Nokes,J.D.,Agoti,C.	KEMRI-Wellcome Trust, Epidemiology and Demography	A.D.4	GA2.3.5	0.0	good	43388	236	15014	0.9686042692939244	1.0	1.0	2018.3164383561643
OQ595310	OQ595310.1	Kilifi/RSVA/HF20080_01/05/2018	2018-05-01	Africa	Kenya	Kilifi		Homo sapiens	2023-04-15		Lambisia et al.	Lambisia,A.W.,Lewa,C.,Mutunga,M.,Cheruiyot,R.,Okanda,D.,Makori,T.,Githinji,G.,Nokes,J.D.,Agoti,C.	KEMRI-Wellcome Trust, Epidemiology and Demography	A.D	GA2.3.5	0.0	good	43430	236	15014	0.9686042692939244	1.0	1.0	2018.3301369863013
OQ595314	OQ595314.1	Kilifi/RSVA/HF20084_11/05/2018	2018-05-11	Africa	Kenya	Kilifi		Homo sapiens	2023-04-15		Lambisia et al.	Lambisia,A.W.,Lewa,C.,Mutunga,M.,Cheruiyot,R.,Okanda,D.,Makori,T.,Githinji,G.,Nokes,J.D.,Agoti,C.	KEMRI-Wellcome Trust, Epidemiology and Demography	A.D.4	GA2.3.5	0.0	good	43380	236	15014	0.9685385878489328	1.0	1.0	2018.3575342465754
OQ595318	OQ595318.1	Kilifi/RSVA/HF20088_30/08/2018	2018-08-30	Africa	Kenya	Kilifi		Homo sapiens	2023-04-15		Lambisia et al.	Lambisia,A.W.,Lewa,C.,Mutunga,M.,Cheruiyot,R.,Okanda,D.,Makori,T.,Githinji,G.,Nokes,J.D.,Agoti,C.	KEMRI-Wellcome Trust, Epidemiology and Demography	A.D.4	GA2.3.5	0.0	good	43256	236	15014	0.9685385878489328	1.0	1.0	2018.6616438356164
OQ595320	OQ595320.1	Kilifi/RSVA/HF20090_19/01/2018	2018-01-19	Africa	Kenya	Kilifi		Homo sapiens	2023-04-15		Lambisia et al.	Lambisia,A.W.,Lewa,C.,Mutunga,M.,Cheruiyot,R.,Okanda,D.,Makori,T.,Githinji,G.,Nokes,J.D.,Agoti,C.	KEMRI-Wellcome Trust, Epidemiology and Demography	A.D.2.2	GA2.3.5	0.0	good	43637	236	15014	0.968735632183908	1.0	1.0	2018.0506849315068
OQ595329	OQ595329.1	Kilifi/RSVA/HF20099_13/02/2018	2018-02-13	Africa	Kenya	Kilifi		Homo sapiens	2023-04-15		Lambisia et al.	Lambisia,A.W.,Lewa,C.,Mutunga,M.,Cheruiyot,R.,Okanda,D.,Makori,T.,Githinji,G.,Nokes,J.D.,Agoti,C.	KEMRI-Wellcome Trust, Epidemiology and Demography	A.D.4	GA2.3.5	0.0	good	43381	236	15014	0.968735632183908	1.0	1.0	2018.1191780821919
OQ595333	OQ595333.1	Kilifi/RSVA/HF20103_19/02/2018	2018-02-19	Africa	Kenya	Kilifi		Homo sapiens	2023-04-15		Lambisia et al.	Lambisia,A.W.,Lewa,C.,Mutunga,M.,Cheruiyot,R.,Okanda,D.,Makori,T.,Githinji,G.,Nokes,J.D.,Agoti,C.	KEMRI-Wellcome Trust, Epidemiology and Demography	A.D	GA2.3.5	0.0	good	43424	239	15014	0.9686042692939244	1.0	1.0	2018.1356164383562
OQ595335	OQ595335.1	Kilifi/RSVA/HF20105_22/02/2018	2018-02-22	Africa	Kenya	Kilifi		Homo sapiens	2023-04-15		Lambisia et al.	Lambisia,A.W.,Lewa,C.,Mutunga,M.,Cheruiyot,R.,Okanda,D.,Makori,T.,Githinji,G.,Nokes,J.D.,Agoti,C.	KEMRI-Wellcome Trust, Epidemiology and Demography	A.D	GA2.3.5	0.0	good	43439	239	15014	0.9685385878489328	1.0	1.0	2018.1438356164383
OQ595341	OQ595341.1	Kilifi/RSVA/HF20111_24/02/2018	2018-02-24	Africa	Kenya	Kilifi		Homo sapiens	2023-04-15		Lambisia et al.	Lambisia,A.W.,Lewa,C.,Mutunga,M.,Cheruiyot,R.,Okanda,D.,Makori,T.,Githinji,G.,Nokes,J.D.,Agoti,C.	KEMRI-Wellcome Trust, Epidemiology and Demography	A.D.4	GA2.3.5	0.0	good	43452	236	15014	0.9688013136289	1.0	1.0	2018.1493150684933
OQ595344	OQ595344.1	Kilifi/RSVA/HF20114_01/03/2018	2018-03-01	Africa	Kenya	Kilifi		Homo sapiens	2023-04-15		Lambisia et al.	Lambisia,A.W.,Lewa,C.,Mutunga,M.,Cheruiyot,R.,Okanda,D.,Makori,T.,Githinji,G.,Nokes,J.D.,Agoti,C.	KEMRI-Wellcome Trust, Epidemiology and Demography	A.D.4	GA2.3.5	0.0	good	43408	236	15014	0.9688013136289	1.0	1.0	2018.16301369863
OQ595351	OQ595351.1	Kilifi/RSVA/HF20121_07/03/2018	2018-03-07	Africa	Kenya	Kilifi		Homo sapiens	2023-04-15		Lambisia et al.	Lambisia,A.W.,Lewa,C.,Mutunga,M.,Cheruiyot,R.,Okanda,D.,Makori,T.,Githinji,G.,Nokes,J.D.,Agoti,C.	KEMRI-Wellcome Trust, Epidemiology and Demography	A.D.4	GA2.3.5	0.0	good	43418	235	15014	0.9688013136289	1.0	1.0	2018.1794520547944
OQ595354	OQ595354.1	Kilifi/RSVA/HF20124_07/03/2018	2018-03-07	Africa	Kenya	Kilifi		Homo sapiens	2023-04-15		Lambisia et al.	Lambisia,A.W.,Lewa,C.,Mutunga,M.,Cheruiyot,R.,Okanda,D.,Makori,T.,Githinji,G.,Nokes,J.D.,Agoti,C.	KEMRI-Wellcome Trust, Epidemiology and Demography	A.D.2.2	GA2.3.5	0.0	good	43640	235	15014	0.9688669950738916	1.0	1.0	2018.1794520547944
OQ595368	OQ595368.1	Kilifi/RSVA/HF20138_07/04/2018	2018-04-07	Africa	Kenya	Kilifi		Homo sapiens	2023-04-15		Lambisia et al.	Lambisia,A.W.,Lewa,C.,Mutunga,M.,Cheruiyot,R.,Okanda,D.,Makori,T.,Githinji,G.,Nokes,J.D.,Agoti,C.	KEMRI-Wellcome Trust, Epidemiology and Demography	A.D	GA2.3.5	0.0	good	43593	239	15014	0.9685385878489328	1.0	1.0	2018.2643835616439
OQ595364	OQ595364.1	Kilifi/RSVA/HF20134_02/04/2018	2018-04-02	Africa	Kenya	Kilifi		Homo sapiens	2023-04-15		Lambisia et al.	Lambisia,A.W.,Lewa,C.,Mutunga,M.,Cheruiyot,R.,Okanda,D.,Makori,T.,Githinji,G.,Nokes,J.D.,Agoti,C.	KEMRI-Wellcome Trust, Epidemiology and Demography	A.D.4	GA2.3.5	0.0	good	43388	236	15014	0.9688013136289	1.0	1.0	2018.2506849315068
OQ848527	OQ848527.1	hRSV/A/USA/6S7/2010	2010-XX-XX	North America	USA			Homo sapiens	2023-05-16	SRR24174237	Sereewit et al.	Sereewit,J.,Hajian,P.,Xie,H.,Greninger,A.L.	UW Virology, Laboratory Medicine	A	unassigned	91.180278	mediocre	42139	1	15220	0.9996059113300492	1.0	1.0	[2010.0013698630137:2010.9986301369863]
OQ595371	OQ595371.1	Kilifi/RSVA/HF20141_24/04/2018	2018-04-24	Africa	Kenya	Kilifi		Homo sapiens	2023-04-15		Lambisia et al.	Lambisia,A.W.,Lewa,C.,Mutunga,M.,Cheruiyot,R.,Okanda,D.,Makori,T.,Githinji,G.,Nokes,J.D.,Agoti,C.	KEMRI-Wellcome Trust, Epidemiology and Demography	A.D	GA2.3.5	0.0	good	43444	236	15014	0.9688013136289	1.0	1.0	2018.3109589041096
OQ848529	OQ848529.1	hRSV/A/USA/7C2/2010	2010-11-XX	North America	USA			Homo sapiens	2023-05-16	SRR24174224	Sereewit et al.	Sereewit,J.,Hajian,P.,Xie,H.,Greninger,A.L.	UW Virology, Laboratory Medicine	A.3.1	GA2.3.3	0.0	good	44687	1	15225	1.0	1.0	1.0	[2010.8342465753424:2010.9136986301369]
OQ848533	OQ848533.1	hRSV/A/USA/7F7/2011	2011-01-XX	North America	USA			Homo sapiens	2023-05-16	SRR24174222	Sereewit et al.	Sereewit,J.,Hajian,P.,Xie,H.,Greninger,A.L.	UW Virology, Laboratory Medicine	A.3.1	GA2.3.3	0.0	good	44683	1	15225	1.0	1.0	1.0	[2011.0013698630137:2011.0835616438355]
OQ848534	OQ848534.1	hRSV/A/USA/7G7/2011	2011-01-XX	North America	USA			Homo sapiens	2023-05-16	SRR24174233	Sereewit et al.	Sereewit,J.,Hajian,P.,Xie,H.,Greninger,A.L.	UW Virology, Laboratory Medicine	A.3.1.1	GA2.3.3	0.0	good	44873	1	15225	1.0	1.0	1.0	[2011.0013698630137:2011.0835616438355]
OQ848535	OQ848535.1	hRSV/A/USA/7H2/2011	2011-01-XX	North America	USA			Homo sapiens	2023-05-16	SRR24174228	Sereewit et al.	Sereewit,J.,Hajian,P.,Xie,H.,Greninger,A.L.	UW Virology, Laboratory Medicine	A.3	GA2.3.1	0.0	good	43800	1	15225	1.0	1.0	1.0	[2011.0013698630137:2011.0835616438355]
OQ848538	OQ848538.1	hRSV/A/USA/7I8/2011	2011-01-XX	North America	USA			Homo sapiens	2023-05-16	SRR24174243	Sereewit et al.	Sereewit,J.,Hajian,P.,Xie,H.,Greninger,A.L.	UW Virology, Laboratory Medicine	A.3.1	GA2.3.3	0.0	good	44686	1	15225	1.0	1.0	1.0	[2011.0013698630137:2011.0835616438355]
OQ848532	OQ848532.1	hRSV/A/USA/7F6/2011	2011-01-XX	North America	USA			Homo sapiens	2023-05-16	SRR24174223	Sereewit et al.	Sereewit,J.,Hajian,P.,Xie,H.,Greninger,A.L.	UW Virology, Laboratory Medicine	A.3.1	GA2.3.3	0.0	good	44622	1	15225	1.0	1.0	1.0	[2011.0013698630137:2011.0835616438355]
OQ848536	OQ848536.1	hRSV/A/USA/7H5/2011	2011-01-XX	North America	USA			Homo sapiens	2023-05-16	SRR24174244	Sereewit et al.	Sereewit,J.,Hajian,P.,Xie,H.,Greninger,A.L.	UW Virology, Laboratory Medicine	A.D	GA2.3.3	0.0	good	44883	44	15208	0.9959934318555008	1.0	1.0	[2011.0013698630137:2011.0835616438355]
OQ848539	OQ848539.1	hRSV/A/USA/7P5/2011	2011-03-XX	North America	USA			Homo sapiens	2023-05-16	SRR24174239	Sereewit et al.	Sereewit,J.,Hajian,P.,Xie,H.,Greninger,A.L.	UW Virology, Laboratory Medicine	A.3.1	GA2.3.3	0.0	good	44602	1	15220	0.999671592775041	1.0	1.0	[2011.16301369863:2011.2452054794521]
OQ848537	OQ848537.1	hRSV/A/USA/7H9/2011	2011-01-XX	North America	USA			Homo sapiens	2023-05-16	SRR24174231	Sereewit et al.	Sereewit,J.,Hajian,P.,Xie,H.,Greninger,A.L.	UW Virology, Laboratory Medicine	A.3.1.1	GA2.3.3	0.0	good	44937	1	15225	1.0	1.0	1.0	[2011.0013698630137:2011.0835616438355]
OQ848540	OQ848540.1	hRSV/A/USA/8B2/2011	2011-05-XX	North America	USA			Homo sapiens	2023-05-16	SRR24174241	Sereewit et al.	Sereewit,J.,Hajian,P.,Xie,H.,Greninger,A.L.	UW Virology, Laboratory Medicine	A.3.1	GA2.3.3	57.8125	mediocre	44713	1	15225	0.9999343185550084	1.0	1.0	[2011.3301369863013:2011.4123287671232]
OQ941716	OQ941716.1	OQ941716	2017-XX-XX	Oceania	Australia			Homo sapiens	2023-08-09		Pangesti et al.	Pangesti,K.N.A.,Ansari,H.R.,Bayoumi,A.,Kesson,A.M.,Hill-Cawthorne,G.A.,Abd El Ghany,M.	Westmead Institute for Medical Research (WIMR) & Sydney Infectious Disease Institute (Sydney ID), Centre for Infectious Diseases and Microbiology	A.D	GA2.3.5	0.0	good	43645	241	15067	0.9738587848932676	1.0	1.0	[2017.0013698630137:2017.9986301369863]
OQ941722	OQ941722.1	OQ941722	2018-XX-XX	Oceania	Australia			Homo sapiens	2023-08-09		Pangesti et al.	Pangesti,K.N.A.,Ansari,H.R.,Bayoumi,A.,Kesson,A.M.,Hill-Cawthorne,G.A.,Abd El Ghany,M.	Westmead Institute for Medical Research (WIMR) & Sydney Infectious Disease Institute (Sydney ID), Centre for Infectious Diseases and Microbiology	A.D	GA2.3.5	56.25	mediocre	43036	241	15014	0.9703776683087028	1.0	1.0	[2018.0013698630137:2018.9986301369863]
OQ941724	OQ941724.1	OQ941724	2016-XX-XX	Oceania	Australia			Homo sapiens	2023-08-09		Pangesti et al.	Pangesti,K.N.A.,Ansari,H.R.,Bayoumi,A.,Kesson,A.M.,Hill-Cawthorne,G.A.,Abd El Ghany,M.	Westmead Institute for Medical Research (WIMR) & Sydney Infectious Disease Institute (Sydney ID), Centre for Infectious Diseases and Microbiology	A.D	GA2.3.5	0.0	good	43970	238	15078	0.9747783251231528	1.0	1.0	[2016.0013661202186:2016.9986338797814]
OQ941726	OQ941726.1	OQ941726	2016-XX-XX	Oceania	Australia			Homo sapiens	2023-08-09		Pangesti et al.	Pangesti,K.N.A.,Ansari,H.R.,Bayoumi,A.,Kesson,A.M.,Hill-Cawthorne,G.A.,Abd El Ghany,M.	Westmead Institute for Medical Research (WIMR) & Sydney Infectious Disease Institute (Sydney ID), Centre for Infectious Diseases and Microbiology	A.D	GA2.3.5	0.0	good	43735	235	15009	0.9704433497536946	1.0	1.0	[2016.0013661202186:2016.9986338797814]
OQ941727	OQ941727.1	OQ941727	2018-XX-XX	Oceania	Australia			Homo sapiens	2023-08-09		Pangesti et al.	Pangesti,K.N.A.,Ansari,H.R.,Bayoumi,A.,Kesson,A.M.,Hill-Cawthorne,G.A.,Abd El Ghany,M.	Westmead Institute for Medical Research (WIMR) & Sydney Infectious Disease Institute (Sydney ID), Centre for Infectious Diseases and Microbiology	A.D.5	GA2.3.5	0.0	good	43867	241	15069	0.9739901477832512	1.0	1.0	[2018.0013698630137:2018.9986301369863]
OQ941735	OQ941735.1	OQ941735	2018-XX-XX	Oceania	Australia			Homo sapiens	2023-08-09		Pangesti et al.	Pangesti,K.N.A.,Ansari,H.R.,Bayoumi,A.,Kesson,A.M.,Hill-Cawthorne,G.A.,Abd El Ghany,M.	Westmead Institute for Medical Research (WIMR) & Sydney Infectious Disease Institute (Sydney ID), Centre for Infectious Diseases and Microbiology	A.D	GA2.3.5	0.0	good	43723	253	15009	0.9692610837438425	1.0	1.0	[2018.0013698630137:2018.9986301369863]
OQ941732	OQ941732.1	OQ941732	2018-XX-XX	Oceania	Australia			Homo sapiens	2023-08-09		Pangesti et al.	Pangesti,K.N.A.,Ansari,H.R.,Bayoumi,A.,Kesson,A.M.,Hill-Cawthorne,G.A.,Abd El Ghany,M.	Westmead Institute for Medical Research (WIMR) & Sydney Infectious Disease Institute (Sydney ID), Centre for Infectious Diseases and Microbiology	A.D.4	GA2.3.5	0.0	good	43790	244	15080	0.9745155993431855	1.0	1.0	[2018.0013698630137:2018.9986301369863]
OQ941737	OQ941737.1	OQ941737	2017-XX-XX	Oceania	Australia			Homo sapiens	2023-08-09		Pangesti et al.	Pangesti,K.N.A.,Ansari,H.R.,Bayoumi,A.,Kesson,A.M.,Hill-Cawthorne,G.A.,Abd El Ghany,M.	Westmead Institute for Medical Research (WIMR) & Sydney Infectious Disease Institute (Sydney ID), Centre for Infectious Diseases and Microbiology	A.D.2.2	GA2.3.5	0.0	good	44082	241	15080	0.9747126436781608	1.0	1.0	[2017.0013698630137:2017.9986301369863]
OQ941741	OQ941741.1	OQ941741	2018-XX-XX	Oceania	Australia			Homo sapiens	2023-08-09		Pangesti et al.	Pangesti,K.N.A.,Ansari,H.R.,Bayoumi,A.,Kesson,A.M.,Hill-Cawthorne,G.A.,Abd El Ghany,M.	Westmead Institute for Medical Research (WIMR) & Sydney Infectious Disease Institute (Sydney ID), Centre for Infectious Diseases and Microbiology	A.D	GA2.3.5	281.694444	bad	40353	1111	15014	0.9132348111658456	1.0	1.0	[2018.0013698630137:2018.9986301369863]
OQ941749	OQ941749.1	OQ941749	2017-XX-XX	Oceania	Australia			Homo sapiens	2023-08-09		Pangesti et al.	Pangesti,K.N.A.,Ansari,H.R.,Bayoumi,A.,Kesson,A.M.,Hill-Cawthorne,G.A.,Abd El Ghany,M.	Westmead Institute for Medical Research (WIMR) & Sydney Infectious Disease Institute (Sydney ID), Centre for Infectious Diseases and Microbiology	A.D	GA2.3.5	0.0	good	43632	244	15014	0.9701806239737274	1.0	1.0	[2017.0013698630137:2017.9986301369863]
OQ941744	OQ941744.1	OQ941744	2018-XX-XX	Oceania	Australia			Homo sapiens	2023-08-09		Pangesti et al.	Pangesti,K.N.A.,Ansari,H.R.,Bayoumi,A.,Kesson,A.M.,Hill-Cawthorne,G.A.,Abd El Ghany,M.	Westmead Institute for Medical Research (WIMR) & Sydney Infectious Disease Institute (Sydney ID), Centre for Infectious Diseases and Microbiology	A.D.5	GA2.3.5	0.0	good	43685	244	15009	0.9698522167487684	1.0	1.0	[2018.0013698630137:2018.9986301369863]
OQ941746	OQ941746.1	OQ941746	2016-XX-XX	Oceania	Australia			Homo sapiens	2023-08-09		Pangesti et al.	Pangesti,K.N.A.,Ansari,H.R.,Bayoumi,A.,Kesson,A.M.,Hill-Cawthorne,G.A.,Abd El Ghany,M.	Westmead Institute for Medical Research (WIMR) & Sydney Infectious Disease Institute (Sydney ID), Centre for Infectious Diseases and Microbiology	A.D	GA2.3.5	0.0	good	43747	241	15014	0.9703776683087028	1.0	1.0	[2016.0013661202186:2016.9986338797814]
OQ941753	OQ941753.1	OQ941753	2016-XX-XX	Oceania	Australia			Homo sapiens	2023-08-09		Pangesti et al.	Pangesti,K.N.A.,Ansari,H.R.,Bayoumi,A.,Kesson,A.M.,Hill-Cawthorne,G.A.,Abd El Ghany,M.	Westmead Institute for Medical Research (WIMR) & Sydney Infectious Disease Institute (Sydney ID), Centre for Infectious Diseases and Microbiology	A.D.2.2	GA2.3.5	572.804444	bad	36678	1111	15014	0.9132348111658456	1.0	1.0	[2016.0013661202186:2016.9986338797814]
OQ941755	OQ941755.1	OQ941755	2016-XX-XX	Oceania	Australia			Homo sapiens	2023-08-09		Pangesti et al.	Pangesti,K.N.A.,Ansari,H.R.,Bayoumi,A.,Kesson,A.M.,Hill-Cawthorne,G.A.,Abd El Ghany,M.	Westmead Institute for Medical Research (WIMR) & Sydney Infectious Disease Institute (Sydney ID), Centre for Infectious Diseases and Microbiology	A.D	GA2.3.5	216.694444	bad	40899	743	15015	0.937471264367816	1.0	1.0	[2016.0013661202186:2016.9986338797814]
OQ941752	OQ941752.1	OQ941752	2016-XX-XX	Oceania	Australia			Homo sapiens	2023-08-09		Pangesti et al.	Pangesti,K.N.A.,Ansari,H.R.,Bayoumi,A.,Kesson,A.M.,Hill-Cawthorne,G.A.,Abd El Ghany,M.	Westmead Institute for Medical Research (WIMR) & Sydney Infectious Disease Institute (Sydney ID), Centre for Infectious Diseases and Microbiology	A.D	GA2.3.5	0.0	good	43707	238	15014	0.970574712643678	1.0	1.0	[2016.0013661202186:2016.9986338797814]
OQ941770	OQ941770.1	OQ941770	1956-XX-XX	Oceania	Australia			Homo sapiens	2023-08-09		Pangesti et al.	Pangesti,K.N.A.,Ansari,H.R.,Bayoumi,A.,Kesson,A.M.,Hill-Cawthorne,G.A.,Abd El Ghany,M.	Westmead Institute for Medical Research (WIMR) & Sydney Infectious Disease Institute (Sydney ID), Centre for Infectious Diseases and Microbiology	A	unassigned	61.387778	mediocre	41235	178	15014	0.9745155993431855	1.0	1.0	[1956.0013661202186:1956.9986338797814]
OQ941771	OQ941771.1	OQ941771	1956-XX-XX	Oceania	Australia			Homo sapiens	2023-08-09		Pangesti et al.	Pangesti,K.N.A.,Ansari,H.R.,Bayoumi,A.,Kesson,A.M.,Hill-Cawthorne,G.A.,Abd El Ghany,M.	Westmead Institute for Medical Research (WIMR) & Sydney Infectious Disease Institute (Sydney ID), Centre for Infectious Diseases and Microbiology	A	unassigned	56.25	mediocre	41122	241	15088	0.9752380952380952	1.0	1.0	[1956.0013661202186:1956.9986338797814]
OQ941767	OQ941767.1	OQ941767	2018-XX-XX	Oceania	Australia			Homo sapiens	2023-08-09		Pangesti et al.	Pangesti,K.N.A.,Ansari,H.R.,Bayoumi,A.,Kesson,A.M.,Hill-Cawthorne,G.A.,Abd El Ghany,M.	Westmead Institute for Medical Research (WIMR) & Sydney Infectious Disease Institute (Sydney ID), Centre for Infectious Diseases and Microbiology	A.D.1	GA2.3.5	0.0	good	43596	241	15009	0.970049261083744	1.0	1.0	[2018.0013698630137:2018.9986301369863]
OQ941775	OQ941775.1	OQ941775	2016-XX-XX	Oceania	Australia			Homo sapiens	2023-08-09		Pangesti et al.	Pangesti,K.N.A.,Ansari,H.R.,Bayoumi,A.,Kesson,A.M.,Hill-Cawthorne,G.A.,Abd El Ghany,M.	Westmead Institute for Medical Research (WIMR) & Sydney Infectious Disease Institute (Sydney ID), Centre for Infectious Diseases and Microbiology	A.D	GA2.3.5	295.84	bad	42874	241	15048	0.9726108374384236	1.0	1.0	[2016.0013661202186:2016.9986338797814]
OQ941772	OQ941772.1	OQ941772	2018-XX-XX	Oceania	Australia			Homo sapiens	2023-08-09		Pangesti et al.	Pangesti,K.N.A.,Ansari,H.R.,Bayoumi,A.,Kesson,A.M.,Hill-Cawthorne,G.A.,Abd El Ghany,M.	Westmead Institute for Medical Research (WIMR) & Sydney Infectious Disease Institute (Sydney ID), Centre for Infectious Diseases and Microbiology	A.D	GA2.3.5	448.29	bad	38706	1111	15014	0.9132348111658456	1.0	1.0	[2018.0013698630137:2018.9986301369863]
OQ941776	OQ941776.1	OQ941776	1956-XX-XX	Oceania	Australia			Homo sapiens	2023-08-09		Pangesti et al.	Pangesti,K.N.A.,Ansari,H.R.,Bayoumi,A.,Kesson,A.M.,Hill-Cawthorne,G.A.,Abd El Ghany,M.	Westmead Institute for Medical Research (WIMR) & Sydney Infectious Disease Institute (Sydney ID), Centre for Infectious Diseases and Microbiology	A	unassigned	225.0	bad	40867	238	15016	0.9707060755336616	1.0	1.0	[1956.0013661202186:1956.9986338797814]
OR143134	OR143134.1	ASU101579	2023-01-31	North America	USA	Arizona		Homo sapiens	2023-06-27		Holland et al.	Holland,S.C.,Holland,L.A.,Smith,M.F.,Leonard,V.R.,Murugan,V.,Nordstrom,L.,Mulrow,M.,Salgado,R.,White,M.,Lim,E.S.	Arizona State University, Center for Fundamental and Applied Microbiomics	A.D.5.2	GA2.3.5	0.0	good	44818	1	15225	0.9999343185550084	1.0	1.0	2023.0835616438355
OR143151	OR143151.1	ASU101601	2022-12-10	North America	USA	Arizona		Homo sapiens	2023-06-27		Holland et al.	Holland,S.C.,Holland,L.A.,Smith,M.F.,Leonard,V.R.,Murugan,V.,Nordstrom,L.,Mulrow,M.,Salgado,R.,White,M.,Lim,E.S.	Arizona State University, Center for Fundamental and Applied Microbiomics	A.D.5.2	GA2.3.5	0.0	good	44837	1	15225	0.9998686371100164	1.0	1.0	2022.941095890411
OR143145	OR143145.1	ASU101595	2022-12-08	North America	USA	Arizona		Homo sapiens	2023-06-27		Holland et al.	Holland,S.C.,Holland,L.A.,Smith,M.F.,Leonard,V.R.,Murugan,V.,Nordstrom,L.,Mulrow,M.,Salgado,R.,White,M.,Lim,E.S.	Arizona State University, Center for Fundamental and Applied Microbiomics	A.D.5.2	GA2.3.5	0.0	good	44842	1	15225	0.9999343185550084	1.0	1.0	2022.9356164383562
OR143157	OR143157.1	ASU102675	2023-01-05	North America	USA	Arizona		Homo sapiens	2023-06-27		Holland et al.	Holland,S.C.,Holland,L.A.,Smith,M.F.,Leonard,V.R.,Murugan,V.,Nordstrom,L.,Mulrow,M.,Salgado,R.,White,M.,Lim,E.S.	Arizona State University, Center for Fundamental and Applied Microbiomics	A.D.5.2	GA2.3.5	0.0	good	44795	1	15225	0.9998686371100164	1.0	1.0	2023.0123287671233
OR143160	OR143160.1	ASU102678	2023-01-25	North America	USA	Arizona		Homo sapiens	2023-06-27		Holland et al.	Holland,S.C.,Holland,L.A.,Smith,M.F.,Leonard,V.R.,Murugan,V.,Nordstrom,L.,Mulrow,M.,Salgado,R.,White,M.,Lim,E.S.	Arizona State University, Center for Fundamental and Applied Microbiomics	A.D.5.2	GA2.3.5	0.0	good	44816	4	15225	0.9995402298850574	1.0	1.0	2023.0671232876712
OR143163	OR143163.1	ASU102683	2023-02-04	North America	USA	Arizona		Homo sapiens	2023-06-27		Holland et al.	Holland,S.C.,Holland,L.A.,Smith,M.F.,Leonard,V.R.,Murugan,V.,Nordstrom,L.,Mulrow,M.,Salgado,R.,White,M.,Lim,E.S.	Arizona State University, Center for Fundamental and Applied Microbiomics	A.D.5.2	GA2.3.5	0.0	good	44837	1	15225	0.9998686371100164	1.0	1.0	2023.0945205479452
OR143192	OR143192.1	ASU102732	2022-12-29	North America	USA	Arizona		Homo sapiens	2023-06-27		Holland et al.	Holland,S.C.,Holland,L.A.,Smith,M.F.,Leonard,V.R.,Murugan,V.,Nordstrom,L.,Mulrow,M.,Salgado,R.,White,M.,Lim,E.S.	Arizona State University, Center for Fundamental and Applied Microbiomics	A.D.5.2	GA2.3.5	56.25	mediocre	44786	1	15225	0.999671592775041	1.0	1.0	2022.9931506849316
OR143194	OR143194.1	ASU102737	2022-12-19	North America	USA	Arizona		Homo sapiens	2023-06-27		Holland et al.	Holland,S.C.,Holland,L.A.,Smith,M.F.,Leonard,V.R.,Murugan,V.,Nordstrom,L.,Mulrow,M.,Salgado,R.,White,M.,Lim,E.S.	Arizona State University, Center for Fundamental and Applied Microbiomics	A.D.5.1	GA2.3.5	0.04	good	44750	1	15225	0.9998029556650246	1.0	1.0	2022.9657534246576
OR143203	OR143203.1	ASU102747	2022-12-06	North America	USA	Arizona		Homo sapiens	2023-06-27		Holland et al.	Holland,S.C.,Holland,L.A.,Smith,M.F.,Leonard,V.R.,Murugan,V.,Nordstrom,L.,Mulrow,M.,Salgado,R.,White,M.,Lim,E.S.	Arizona State University, Center for Fundamental and Applied Microbiomics	A.D.5.2	GA2.3.5	0.0	good	44784	1	15225	0.9999343185550084	1.0	1.0	2022.9301369863015
OR143210	OR143210.1	ASU102759	2023-01-01	North America	USA	Arizona		Homo sapiens	2023-06-27		Holland et al.	Holland,S.C.,Holland,L.A.,Smith,M.F.,Leonard,V.R.,Murugan,V.,Nordstrom,L.,Mulrow,M.,Salgado,R.,White,M.,Lim,E.S.	Arizona State University, Center for Fundamental and Applied Microbiomics	A.D.3	GA2.3.5	0.0	good	44785	1	15225	0.9999343185550084	1.0	1.0	2023.0013698630137
OR143211	OR143211.1	ASU102760	2023-01-08	North America	USA	Arizona		Homo sapiens	2023-06-27		Holland et al.	Holland,S.C.,Holland,L.A.,Smith,M.F.,Leonard,V.R.,Murugan,V.,Nordstrom,L.,Mulrow,M.,Salgado,R.,White,M.,Lim,E.S.	Arizona State University, Center for Fundamental and Applied Microbiomics	A.D.5.2	GA2.3.5	0.0	good	44830	1	15225	0.9999343185550084	1.0	1.0	2023.0205479452054
OR143212	OR143212.1	ASU102763	2022-12-08	North America	USA	Arizona		Homo sapiens	2023-06-27		Holland et al.	Holland,S.C.,Holland,L.A.,Smith,M.F.,Leonard,V.R.,Murugan,V.,Nordstrom,L.,Mulrow,M.,Salgado,R.,White,M.,Lim,E.S.	Arizona State University, Center for Fundamental and Applied Microbiomics	A.D.3.4	GA2.3.5	0.0	good	44827	1	15225	1.0	1.0	1.0	2022.9356164383562
OR162201	OR162201.1	Kilifi/RSVA/HF20146_2021-03-23	2021-03-23	Africa	Kenya	Kilifi		Homo sapiens	2023-07-29		Lambisia et al.	Lambisia,A.W.,Lewa,C.,Mutunga,M.,Okanda,D.,Githinji,G.,Nokes,J.D.,Agoti,C.N.	KEMRI-Wellcome Trust, Epidemiology and Demography	A.D.5	GA2.3.5	0.0	good	41547	235	15014	0.8488013136288999	1.0	1.0	2021.2232876712328
OR162199	OR162199.1	Kilifi/RSVA/HF20144_2021-03-20	2021-03-20	Africa	Kenya	Kilifi		Homo sapiens	2023-07-29		Lambisia et al.	Lambisia,A.W.,Lewa,C.,Mutunga,M.,Okanda,D.,Githinji,G.,Nokes,J.D.,Agoti,C.N.	KEMRI-Wellcome Trust, Epidemiology and Demography	A.D.5	GA2.3.5	0.0	good	37693	236	13106	0.8435467980295567	1.0	1.0	2021.2150684931507
OR143219	OR143219.1	ASU102777	2022-12-01	North America	USA	Arizona		Homo sapiens	2023-06-27		Holland et al.	Holland,S.C.,Holland,L.A.,Smith,M.F.,Leonard,V.R.,Murugan,V.,Nordstrom,L.,Mulrow,M.,Salgado,R.,White,M.,Lim,E.S.	Arizona State University, Center for Fundamental and Applied Microbiomics	A.D.5.2	GA2.3.5	0.0	good	44762	1	15225	0.9999343185550084	1.0	1.0	2022.9164383561645
OR143222	OR143222.1	ASU102786	2022-11-30	North America	USA	Arizona		Homo sapiens	2023-06-27		Holland et al.	Holland,S.C.,Holland,L.A.,Smith,M.F.,Leonard,V.R.,Murugan,V.,Nordstrom,L.,Mulrow,M.,Salgado,R.,White,M.,Lim,E.S.	Arizona State University, Center for Fundamental and Applied Microbiomics	A.D.1.8	GA2.3.5	0.0	good	44722	1	15225	1.0	1.0	1.0	2022.9136986301369
OR143224	OR143224.1	ASU102788	2022-12-04	North America	USA	Arizona		Homo sapiens	2023-06-27		Holland et al.	Holland,S.C.,Holland,L.A.,Smith,M.F.,Leonard,V.R.,Murugan,V.,Nordstrom,L.,Mulrow,M.,Salgado,R.,White,M.,Lim,E.S.	Arizona State University, Center for Fundamental and Applied Microbiomics	A.D.1.6	GA2.3.5	0.0	good	44601	6	15220	0.985024630541872	1.0	1.0	2022.9246575342465
OR162205	OR162205.1	Kilifi/RSVA/HF20150_2021-04-01	2021-04-01	Africa	Kenya	Kilifi		Homo sapiens	2023-07-29		Lambisia et al.	Lambisia,A.W.,Lewa,C.,Mutunga,M.,Okanda,D.,Githinji,G.,Nokes,J.D.,Agoti,C.N.	KEMRI-Wellcome Trust, Epidemiology and Demography	A.D.4	GA2.3.5	0.0	good	43190	235	15014	0.9688669950738916	1.0	1.0	2021.2479452054795
OR162202	OR162202.1	Kilifi/RSVA/HF20147_2021-03-26	2021-03-26	Africa	Kenya	Kilifi		Homo sapiens	2023-07-29		Lambisia et al.	Lambisia,A.W.,Lewa,C.,Mutunga,M.,Okanda,D.,Githinji,G.,Nokes,J.D.,Agoti,C.N.	KEMRI-Wellcome Trust, Epidemiology and Demography	A.D.4	GA2.3.5	0.0	good	43313	234	15014	0.9689326765188834	1.0	1.0	2021.231506849315
OR162207	OR162207.1	Kilifi/RSVA/HF20152_2021-04-01	2021-04-01	Africa	Kenya	Kilifi		Homo sapiens	2023-07-29		Lambisia et al.	Lambisia,A.W.,Lewa,C.,Mutunga,M.,Okanda,D.,Githinji,G.,Nokes,J.D.,Agoti,C.N.	KEMRI-Wellcome Trust, Epidemiology and Demography	A.D.5	GA2.3.5	0.0	good	43348	235	15014	0.9689326765188834	1.0	1.0	2021.2479452054795
OR162210	OR162210.1	Kilifi/RSVA/HF20155_2021-08-28	2021-08-28	Africa	Kenya	Kilifi		Homo sapiens	2023-07-29		Lambisia et al.	Lambisia,A.W.,Lewa,C.,Mutunga,M.,Okanda,D.,Githinji,G.,Nokes,J.D.,Agoti,C.N.	KEMRI-Wellcome Trust, Epidemiology and Demography	A.D.5	GA2.3.5	0.0	good	43335	236	15014	0.968735632183908	1.0	1.0	2021.6561643835616
OR162219	OR162219.1	Kilifi/RSVA/HF20164_2022-02-16	2022-02-16	Africa	Kenya	Kilifi		Homo sapiens	2023-07-29		Lambisia et al.	Lambisia,A.W.,Lewa,C.,Mutunga,M.,Okanda,D.,Githinji,G.,Nokes,J.D.,Agoti,C.N.	KEMRI-Wellcome Trust, Epidemiology and Demography	A.D.1	GA2.3.5	0.0	good	43313	236	15014	0.9685385878489328	1.0	1.0	2022.127397260274
OR162239	OR162239.1	Kilifi/RSVA/HF20184_2022-03-04	2022-03-04	Africa	Kenya	Kilifi		Homo sapiens	2023-07-29		Lambisia et al.	Lambisia,A.W.,Lewa,C.,Mutunga,M.,Okanda,D.,Githinji,G.,Nokes,J.D.,Agoti,C.N.	KEMRI-Wellcome Trust, Epidemiology and Demography	A.D.4	GA2.3.5	0.0	good	43204	236	15014	0.9688669950738916	1.0	1.0	2022.1712328767123
OR162250	OR162250.1	Kilifi/RSVA/HF20195_2022-03-12	2022-03-12	Africa	Kenya	Kilifi		Homo sapiens	2023-07-29		Lambisia et al.	Lambisia,A.W.,Lewa,C.,Mutunga,M.,Okanda,D.,Githinji,G.,Nokes,J.D.,Agoti,C.N.	KEMRI-Wellcome Trust, Epidemiology and Demography	A.D.1	GA2.3.5	0.0	good	43319	236	15014	0.968735632183908	1.0	1.0	2022.1931506849314
OR162253	OR162253.1	Kilifi/RSVA/HF20198_2022-03-19	2022-03-19	Africa	Kenya	Kilifi		Homo sapiens	2023-07-29		Lambisia et al.	Lambisia,A.W.,Lewa,C.,Mutunga,M.,Okanda,D.,Githinji,G.,Nokes,J.D.,Agoti,C.N.	KEMRI-Wellcome Trust, Epidemiology and Demography	A.D.1	GA2.3.5	0.0	good	43361	239	15014	0.9684729064039408	1.0	1.0	2022.2123287671234
OR162271	OR162271.1	Kilifi/RSVA/HF20216_2022-06-22	2022-06-22	Africa	Kenya	Kilifi		Homo sapiens	2023-07-29		Lambisia et al.	Lambisia,A.W.,Lewa,C.,Mutunga,M.,Okanda,D.,Githinji,G.,Nokes,J.D.,Agoti,C.N.	KEMRI-Wellcome Trust, Epidemiology and Demography	A.D.1	GA2.3.5	0.0	good	43307	236	15014	0.968735632183908	1.0	1.0	2022.472602739726
OR287844	OR287844.1	RSV-A/human/USA/WA-S23230/2019	2019-11-03	North America	USA	Washington	King County WA	Homo sapiens	2023-08-26		Frazar et al.	Frazar,C.D.,Lee,J.,Ryke,E.,Gamboa,L.,McDermot,E.,Stone,J.,Kolar,T.,Han,P.D.,Sibley,T.R.,Truong,M.,Reinhart,D.,Wolf,C.R.,Boeckh,M.,Englund,J.A.,Lutz,B.R.,Waghmare,A.,Viboud,C.,Starita,L.M.,Shendure,J.,Bedford,T.,Chu,H.Y.	The Brotman Baty Institute for Precision Medicine	A.D.1.1	GA2.3.5	0.0	good	44816	25	15222	0.9971100164203612	1.0	1.0	2019.8397260273973
OR287848	OR287848.1	RSV-A/human/USA/WA-S23234/2019	2019-11-17	North America	USA	Washington	Snohomish County	Homo sapiens	2023-08-26		Frazar et al.	Frazar,C.D.,Lee,J.,Ryke,E.,Gamboa,L.,McDermot,E.,Stone,J.,Kolar,T.,Han,P.D.,Sibley,T.R.,Truong,M.,Reinhart,D.,Wolf,C.R.,Boeckh,M.,Englund,J.A.,Lutz,B.R.,Waghmare,A.,Viboud,C.,Starita,L.M.,Shendure,J.,Bedford,T.,Chu,H.Y.	The Brotman Baty Institute for Precision Medicine	A.D.1	GA2.3.5	0.0	good	44860	24	15222	0.9972413793103448	1.0	1.0	2019.8780821917808
OR287853	OR287853.1	RSV-A/human/USA/WA-S23239/2019	2019-11-20	North America	USA	Washington	King County WA	Homo sapiens	2023-08-26		Frazar et al.	Frazar,C.D.,Lee,J.,Ryke,E.,Gamboa,L.,McDermot,E.,Stone,J.,Kolar,T.,Han,P.D.,Sibley,T.R.,Truong,M.,Reinhart,D.,Wolf,C.R.,Boeckh,M.,Englund,J.A.,Lutz,B.R.,Waghmare,A.,Viboud,C.,Starita,L.M.,Shendure,J.,Bedford,T.,Chu,H.Y.	The Brotman Baty Institute for Precision Medicine	A.D.5	GA2.3.5	0.0	good	44774	25	15222	0.9961247947454844	1.0	1.0	2019.886301369863
OR287859	OR287859.1	RSV-A/human/USA/WA-S23245/2019	2019-11-27	North America	USA	Washington	King County WA	Homo sapiens	2023-08-26		Frazar et al.	Frazar,C.D.,Lee,J.,Ryke,E.,Gamboa,L.,McDermot,E.,Stone,J.,Kolar,T.,Han,P.D.,Sibley,T.R.,Truong,M.,Reinhart,D.,Wolf,C.R.,Boeckh,M.,Englund,J.A.,Lutz,B.R.,Waghmare,A.,Viboud,C.,Starita,L.M.,Shendure,J.,Bedford,T.,Chu,H.Y.	The Brotman Baty Institute for Precision Medicine	A.D.1	GA2.3.5	0.0	good	44817	25	15222	0.9979638752052544	1.0	1.0	2019.9054794520548
OR287875	OR287875.1	RSV-A/human/USA/WA-S23261/2019	2019-12-08	North America	USA	Washington	Snohomish County	Homo sapiens	2023-08-26		Frazar et al.	Frazar,C.D.,Lee,J.,Ryke,E.,Gamboa,L.,McDermot,E.,Stone,J.,Kolar,T.,Han,P.D.,Sibley,T.R.,Truong,M.,Reinhart,D.,Wolf,C.R.,Boeckh,M.,Englund,J.A.,Lutz,B.R.,Waghmare,A.,Viboud,C.,Starita,L.M.,Shendure,J.,Bedford,T.,Chu,H.Y.	The Brotman Baty Institute for Precision Medicine	A.D.1	GA2.3.5	0.0	good	44833	25	15220	0.9966502463054188	1.0	1.0	2019.9356164383562
OR287881	OR287881.1	RSV-A/human/USA/WA-S23267/2019	2019-12-14	North America	USA	Washington		Homo sapiens	2023-08-26		Frazar et al.	Frazar,C.D.,Lee,J.,Ryke,E.,Gamboa,L.,McDermot,E.,Stone,J.,Kolar,T.,Han,P.D.,Sibley,T.R.,Truong,M.,Reinhart,D.,Wolf,C.R.,Boeckh,M.,Englund,J.A.,Lutz,B.R.,Waghmare,A.,Viboud,C.,Starita,L.M.,Shendure,J.,Bedford,T.,Chu,H.Y.	The Brotman Baty Institute for Precision Medicine	A.D.1.1	GA2.3.5	0.0	good	44798	25	15222	0.9972413793103448	1.0	1.0	2019.9520547945206
OR287890	OR287890.1	RSV-A/human/USA/WA-S23276/2019	2019-12-22	North America	USA	Washington	Snohomish County	Homo sapiens	2023-08-26		Frazar et al.	Frazar,C.D.,Lee,J.,Ryke,E.,Gamboa,L.,McDermot,E.,Stone,J.,Kolar,T.,Han,P.D.,Sibley,T.R.,Truong,M.,Reinhart,D.,Wolf,C.R.,Boeckh,M.,Englund,J.A.,Lutz,B.R.,Waghmare,A.,Viboud,C.,Starita,L.M.,Shendure,J.,Bedford,T.,Chu,H.Y.	The Brotman Baty Institute for Precision Medicine	A.D.1	GA2.3.5	0.0	good	44839	25	15222	0.9973070607553366	1.0	1.0	2019.9739726027397
OR287899	OR287899.1	RSV-A/human/USA/WA-S23285/2019	2019-12-27	North America	USA	Washington		Homo sapiens	2023-08-26		Frazar et al.	Frazar,C.D.,Lee,J.,Ryke,E.,Gamboa,L.,McDermot,E.,Stone,J.,Kolar,T.,Han,P.D.,Sibley,T.R.,Truong,M.,Reinhart,D.,Wolf,C.R.,Boeckh,M.,Englund,J.A.,Lutz,B.R.,Waghmare,A.,Viboud,C.,Starita,L.M.,Shendure,J.,Bedford,T.,Chu,H.Y.	The Brotman Baty Institute for Precision Medicine	A.D.3	GA2.3.5	0.111111	good	44718	25	15191	0.9961247947454844	1.0	1.0	2019.9876712328767
OR287909	OR287909.1	RSV-A/human/USA/WA-S23295/2019	2019-12-29	North America	USA	Washington	Snohomish County	Homo sapiens	2023-08-26		Frazar et al.	Frazar,C.D.,Lee,J.,Ryke,E.,Gamboa,L.,McDermot,E.,Stone,J.,Kolar,T.,Han,P.D.,Sibley,T.R.,Truong,M.,Reinhart,D.,Wolf,C.R.,Boeckh,M.,Englund,J.A.,Lutz,B.R.,Waghmare,A.,Viboud,C.,Starita,L.M.,Shendure,J.,Bedford,T.,Chu,H.Y.	The Brotman Baty Institute for Precision Medicine	A.D.1	GA2.3.5	0.0	good	44835	25	15222	0.996256157635468	1.0	1.0	2019.9931506849316
OR287943	OR287943.1	RSV-A/human/USA/WA-S23329/2020	2020-01-13	North America	USA	Washington	King County WA	Homo sapiens	2023-08-26		Frazar et al.	Frazar,C.D.,Lee,J.,Ryke,E.,Gamboa,L.,McDermot,E.,Stone,J.,Kolar,T.,Han,P.D.,Sibley,T.R.,Truong,M.,Reinhart,D.,Wolf,C.R.,Boeckh,M.,Englund,J.A.,Lutz,B.R.,Waghmare,A.,Viboud,C.,Starita,L.M.,Shendure,J.,Bedford,T.,Chu,H.Y.	The Brotman Baty Institute for Precision Medicine	A.D.1	GA2.3.5	0.0	good	44557	25	15139	0.988111658456486	1.0	1.0	2020.0341530054645
OR287952	OR287952.1	RSV-A/human/USA/WA-S23338/2020	2020-01-22	North America	USA	Washington		Homo sapiens	2023-08-26		Frazar et al.	Frazar,C.D.,Lee,J.,Ryke,E.,Gamboa,L.,McDermot,E.,Stone,J.,Kolar,T.,Han,P.D.,Sibley,T.R.,Truong,M.,Reinhart,D.,Wolf,C.R.,Boeckh,M.,Englund,J.A.,Lutz,B.R.,Waghmare,A.,Viboud,C.,Starita,L.M.,Shendure,J.,Bedford,T.,Chu,H.Y.	The Brotman Baty Institute for Precision Medicine	A.D.1	GA2.3.5	0.0	good	43068	90	15038	0.910935960591133	1.0	1.0	2020.058743169399
OR287965	OR287965.1	RSV-A/human/USA/WA-S23351/2020	2020-01-31	North America	USA	Washington	Snohomish County	Homo sapiens	2023-08-26		Frazar et al.	Frazar,C.D.,Lee,J.,Ryke,E.,Gamboa,L.,McDermot,E.,Stone,J.,Kolar,T.,Han,P.D.,Sibley,T.R.,Truong,M.,Reinhart,D.,Wolf,C.R.,Boeckh,M.,Englund,J.A.,Lutz,B.R.,Waghmare,A.,Viboud,C.,Starita,L.M.,Shendure,J.,Bedford,T.,Chu,H.Y.	The Brotman Baty Institute for Precision Medicine	A.D.1	GA2.3.5	0.0	good	44862	6	15198	0.9978981937602628	1.0	1.0	2020.0833333333333
OR287984	OR287984.1	RSV-A/human/USA/WA-S23370/2020	2020-03-14	North America	USA	Washington	King County WA	Homo sapiens	2023-08-26		Frazar et al.	Frazar,C.D.,Lee,J.,Ryke,E.,Gamboa,L.,McDermot,E.,Stone,J.,Kolar,T.,Han,P.D.,Sibley,T.R.,Truong,M.,Reinhart,D.,Wolf,C.R.,Boeckh,M.,Englund,J.A.,Lutz,B.R.,Waghmare,A.,Viboud,C.,Starita,L.M.,Shendure,J.,Bedford,T.,Chu,H.Y.	The Brotman Baty Institute for Precision Medicine	A.D.1.1	GA2.3.5	0.0	good	44709	25	15197	0.9965188834154352	1.0	1.0	2020.200819672131
OR287981	OR287981.1	RSV-A/human/USA/WA-S23367/2020	2020-02-18	North America	USA	Washington	King County WA	Homo sapiens	2023-08-26		Frazar et al.	Frazar,C.D.,Lee,J.,Ryke,E.,Gamboa,L.,McDermot,E.,Stone,J.,Kolar,T.,Han,P.D.,Sibley,T.R.,Truong,M.,Reinhart,D.,Wolf,C.R.,Boeckh,M.,Englund,J.A.,Lutz,B.R.,Waghmare,A.,Viboud,C.,Starita,L.M.,Shendure,J.,Bedford,T.,Chu,H.Y.	The Brotman Baty Institute for Precision Medicine	A.D.1	GA2.3.5	0.0	good	43687	99	15038	0.9513300492610838	1.0	1.0	2020.1325136612022
OR287986	OR287986.1	RSV-A/human/USA/WA-S23372/2021	2021-08-18	North America	USA	Washington	King County WA	Homo sapiens	2023-08-26		Frazar et al.	Frazar,C.D.,Lee,J.,Ryke,E.,Gamboa,L.,McDermot,E.,Stone,J.,Kolar,T.,Han,P.D.,Sibley,T.R.,Truong,M.,Reinhart,D.,Wolf,C.R.,Duchin,J.,Boeckh,M.,Englund,J.A.,Lutz,B.R.,Waghmare,A.,Viboud,C.,Starita,L.M.,Chu,H.Y.,Bedford,T.,Shendure,J.	The Brotman Baty Institute for Precision Medicine	A.D.3	GA2.3.5	0.0	good	44348	25	15071	0.9883087027914614	1.0	1.0	2021.6287671232876
OR287999	OR287999.1	Zam-LSK131_2018-04-01	2018-04-01	Africa	Zambia			Homo sapiens	2023-08-26		Simusika et al.	Simusika,P.,Okamoto,M.,Sakamoto,M.,Dapat,C.,Imamura,T.,Saito,M.,Azam,S.,Mwila,E.,Monze,M.,Oshitani,H.	Tohoku University, Graduate school of Medicine, Virology Department	A.D	GA2.3.5	0.0	good	42739	224	14767	0.9394417077175696	1.0	1.0	2018.2479452054795
OR288003	OR288003.1	Zam-LSK276_2018-06-16	2018-06-16	Africa	Zambia			Homo sapiens	2023-08-26		Simusika et al.	Simusika,P.,Okamoto,M.,Sakamoto,M.,Dapat,C.,Imamura,T.,Saito,M.,Azam,S.,Mwila,E.,Monze,M.,Oshitani,H.	Tohoku University, Graduate school of Medicine, Virology Department	A.D	GA2.3.5	0.0	good	42871	224	14767	0.949688013136289	1.0	1.0	2018.4561643835616
OR288011	OR288011.1	Zam-LSK074_2019-03-13	2019-03-13	Africa	Zambia			Homo sapiens	2023-08-26		Simusika et al.	Simusika,P.,Okamoto,M.,Sakamoto,M.,Dapat,C.,Imamura,T.,Saito,M.,Azam,S.,Mwila,E.,Monze,M.,Oshitani,H.	Tohoku University, Graduate school of Medicine, Virology Department	A.D	GA2.3.5	1.5625	good	42956	224	14767	0.9552052545155992	1.0	1.0	2019.195890410959
OR466329	OR466329.1	p1306-121310703A	2012-02-13	North America	USA			Homo sapiens	2023-10-01		Avadhanula et al.	Avadhanula,V.,Agustinho,D.P.,Menon,V.K.,Chemaly,R.F.,Shah,D.P.,Qin,X.,Surathu,A.,Doddapaneni,H.,Muzny,D.M.,Metcalf,G.A.,Gregeen,S.J.,Gibbs,R.A.,Petrosino,J.J.,Sedlazeck,F.J.,Piedra,P.A.	Baylor College of Medicine, Human Genome Sequencing Center	A.D	GA2.3.5	0.0	good	44967	1	15132	0.9938916256157636	1.0	1.0	2012.1188524590164
OR466327	OR466327.1	p1306-121310701A	2012-01-05	North America	USA			Homo sapiens	2023-10-01		Avadhanula et al.	Avadhanula,V.,Agustinho,D.P.,Menon,V.K.,Chemaly,R.F.,Shah,D.P.,Qin,X.,Surathu,A.,Doddapaneni,H.,Muzny,D.M.,Metcalf,G.A.,Gregeen,S.J.,Gibbs,R.A.,Petrosino,J.J.,Sedlazeck,F.J.,Piedra,P.A.	Baylor College of Medicine, Human Genome Sequencing Center	A.3.1.1	GA2.3.3	0.0	good	44883	1	15225	1.0	1.0	1.0	2012.0122950819673
OR466333	OR466333.1	p1306-121310707C	2012-10-12	North America	USA			Homo sapiens	2023-10-01		Avadhanula et al.	Avadhanula,V.,Agustinho,D.P.,Menon,V.K.,Chemaly,R.F.,Shah,D.P.,Qin,X.,Surathu,A.,Doddapaneni,H.,Muzny,D.M.,Metcalf,G.A.,Gregeen,S.J.,Gibbs,R.A.,Petrosino,J.J.,Sedlazeck,F.J.,Piedra,P.A.	Baylor College of Medicine, Human Genome Sequencing Center	A.D	GA2.3.5	0.0	good	44951	1	15132	0.9938916256157636	1.0	1.0	2012.7800546448088
OR466337	OR466337.1	p1306-121310711A	2012-12-13	North America	USA			Homo sapiens	2023-10-01		Avadhanula et al.	Avadhanula,V.,Agustinho,D.P.,Menon,V.K.,Chemaly,R.F.,Shah,D.P.,Qin,X.,Surathu,A.,Doddapaneni,H.,Muzny,D.M.,Metcalf,G.A.,Gregeen,S.J.,Gibbs,R.A.,Petrosino,J.J.,Sedlazeck,F.J.,Piedra,P.A.	Baylor College of Medicine, Human Genome Sequencing Center	A.D	GA2.3.5	0.0	good	45175	1	15225	1.0	1.0	1.0	2012.9494535519125
OR466340	OR466340.1	p1306-121310714A	2013-01-10	North America	USA			Homo sapiens	2023-10-01		Avadhanula et al.	Avadhanula,V.,Agustinho,D.P.,Menon,V.K.,Chemaly,R.F.,Shah,D.P.,Qin,X.,Surathu,A.,Doddapaneni,H.,Muzny,D.M.,Metcalf,G.A.,Gregeen,S.J.,Gibbs,R.A.,Petrosino,J.J.,Sedlazeck,F.J.,Piedra,P.A.	Baylor College of Medicine, Human Genome Sequencing Center	A.D	GA2.3.5	0.0	good	45235	1	15225	1.0	1.0	1.0	2013.0260273972603
OR466334	OR466334.1	p1306-121310708A	2012-10-26	North America	USA			Homo sapiens	2023-10-01		Avadhanula et al.	Avadhanula,V.,Agustinho,D.P.,Menon,V.K.,Chemaly,R.F.,Shah,D.P.,Qin,X.,Surathu,A.,Doddapaneni,H.,Muzny,D.M.,Metcalf,G.A.,Gregeen,S.J.,Gibbs,R.A.,Petrosino,J.J.,Sedlazeck,F.J.,Piedra,P.A.	Baylor College of Medicine, Human Genome Sequencing Center	A.D	GA2.3.5	0.0	good	44795	1	15080	0.9904761904761904	1.0	1.0	2012.818306010929
OR466342	OR466342.1	p1306-121310716A	2013-01-11	North America	USA			Homo sapiens	2023-10-01		Avadhanula et al.	Avadhanula,V.,Agustinho,D.P.,Menon,V.K.,Chemaly,R.F.,Shah,D.P.,Qin,X.,Surathu,A.,Doddapaneni,H.,Muzny,D.M.,Metcalf,G.A.,Gregeen,S.J.,Gibbs,R.A.,Petrosino,J.J.,Sedlazeck,F.J.,Piedra,P.A.	Baylor College of Medicine, Human Genome Sequencing Center	A.3.1	GA2.3.3	0.0	good	44649	1	15225	1.0	1.0	1.0	2013.0287671232877
OR466349	OR466349.1	p1306-121310723A	2013-01-23	North America	USA			Homo sapiens	2023-10-01		Avadhanula et al.	Avadhanula,V.,Agustinho,D.P.,Menon,V.K.,Chemaly,R.F.,Shah,D.P.,Qin,X.,Surathu,A.,Doddapaneni,H.,Muzny,D.M.,Metcalf,G.A.,Gregeen,S.J.,Gibbs,R.A.,Petrosino,J.J.,Sedlazeck,F.J.,Piedra,P.A.	Baylor College of Medicine, Human Genome Sequencing Center	A.D	GA2.3.5	0.0	good	44889	1	15128	0.9936288998357964	1.0	1.0	2013.0616438356165
OR466351	OR466351.1	p1306-121310726A	2013-02-28	North America	USA			Homo sapiens	2023-10-01		Avadhanula et al.	Avadhanula,V.,Agustinho,D.P.,Menon,V.K.,Chemaly,R.F.,Shah,D.P.,Qin,X.,Surathu,A.,Doddapaneni,H.,Muzny,D.M.,Metcalf,G.A.,Gregeen,S.J.,Gibbs,R.A.,Petrosino,J.J.,Sedlazeck,F.J.,Piedra,P.A.	Baylor College of Medicine, Human Genome Sequencing Center	A.D	GA2.3.5	0.0	good	45051	1	15225	0.993694581280788	1.0	1.0	2013.1602739726027
OR466350	OR466350.1	p1306-121310724A	2013-01-29	North America	USA			Homo sapiens	2023-10-01		Avadhanula et al.	Avadhanula,V.,Agustinho,D.P.,Menon,V.K.,Chemaly,R.F.,Shah,D.P.,Qin,X.,Surathu,A.,Doddapaneni,H.,Muzny,D.M.,Metcalf,G.A.,Gregeen,S.J.,Gibbs,R.A.,Petrosino,J.J.,Sedlazeck,F.J.,Piedra,P.A.	Baylor College of Medicine, Human Genome Sequencing Center	A.D	GA2.3.5	0.0	good	45195	1	15225	1.0	1.0	1.0	2013.0780821917808
OR466353	OR466353.1	p1306-121310728A	2013-03-05	North America	USA			Homo sapiens	2023-10-01		Avadhanula et al.	Avadhanula,V.,Agustinho,D.P.,Menon,V.K.,Chemaly,R.F.,Shah,D.P.,Qin,X.,Surathu,A.,Doddapaneni,H.,Muzny,D.M.,Metcalf,G.A.,Gregeen,S.J.,Gibbs,R.A.,Petrosino,J.J.,Sedlazeck,F.J.,Piedra,P.A.	Baylor College of Medicine, Human Genome Sequencing Center	A.D	GA2.3.5	0.0	good	45129	1	15225	1.0	1.0	1.0	2013.1739726027397
OR466361	OR466361.1	p1306-121310737A	2013-12-30	North America	USA			Homo sapiens	2023-10-01		Avadhanula et al.	Avadhanula,V.,Agustinho,D.P.,Menon,V.K.,Chemaly,R.F.,Shah,D.P.,Qin,X.,Surathu,A.,Doddapaneni,H.,Muzny,D.M.,Metcalf,G.A.,Gregeen,S.J.,Gibbs,R.A.,Petrosino,J.J.,Sedlazeck,F.J.,Piedra,P.A.	Baylor College of Medicine, Human Genome Sequencing Center	A.D	GA2.3.5	0.0	good	45195	1	15225	1.0	1.0	1.0	2013.995890410959
OR522460	OR522460.1	RSV-A/human/USA/WA-S23747/2022	2022-10-26	North America	USA	Washington	King County WA	Homo sapiens	2023-10-11		Frazar et al.	Frazar,C.D.,Lee,J.,Ryke,E.,Gamboa,L.,McDermot,E.,Kolar,T.,Han,P.D.,Sibley,T.R.,Reinhart,D.,Grindstaff,S.,Truong,M.,Babu,T.M.,Feldstein,L.R.,Saydah,S.,Briggs-Hagen,M.,Casto,A.,Ehmen,B.,Englund,J.A.,Fortmann,S.P.,Kuntz,J.L.,Lockwood,T.,Midgley,C.M.,Mularski,R.A.,Ogilvie,T.,Reich,S.,Schmidt,M.A.,Smith,N.,Starita,L.,Stone,J.,Vandermeer,M.,Weil,A.A.,Wolf,C.R.,Chu,H.Y.,Naleway,A.L.	The Brotman Baty Institute for Precision Medicine	A.D.3	GA2.3.5	0.0	good	44755	24	15222	0.9982922824302136	1.0	1.0	2022.817808219178
OR522477	OR522477.1	RSV-A/human/USA/WA-S23764/2022	2022-11-10	North America	USA	Washington	King County WA	Homo sapiens	2023-10-11		Frazar et al.	Frazar,C.D.,Lee,J.,Ryke,E.,Gamboa,L.,McDermot,E.,Kolar,T.,Han,P.D.,Sibley,T.R.,Reinhart,D.,Grindstaff,S.,Truong,M.,Babu,T.M.,Feldstein,L.R.,Saydah,S.,Briggs-Hagen,M.,Casto,A.,Ehmen,B.,Englund,J.A.,Fortmann,S.P.,Kuntz,J.L.,Lockwood,T.,Midgley,C.M.,Mularski,R.A.,Ogilvie,T.,Reich,S.,Schmidt,M.A.,Smith,N.,Starita,L.,Stone,J.,Vandermeer,M.,Weil,A.A.,Wolf,C.R.,Chu,H.Y.,Naleway,A.L.	The Brotman Baty Institute for Precision Medicine	A.D.3.2	GA2.3.5	0.0	good	43072	64	15038	0.9116584564860428	1.0	1.0	2022.858904109589
OR522483	OR522483.1	RSV-A/human/USA/WA-S23770/2022	2022-12-05	North America	USA	Washington	King County WA	Homo sapiens	2023-10-11		Frazar et al.	Frazar,C.D.,Lee,J.,Ryke,E.,Gamboa,L.,McDermot,E.,Kolar,T.,Han,P.D.,Sibley,T.R.,Reinhart,D.,Grindstaff,S.,Truong,M.,Babu,T.M.,Feldstein,L.R.,Saydah,S.,Briggs-Hagen,M.,Casto,A.,Ehmen,B.,Englund,J.A.,Fortmann,S.P.,Kuntz,J.L.,Lockwood,T.,Midgley,C.M.,Mularski,R.A.,Ogilvie,T.,Reich,S.,Schmidt,M.A.,Smith,N.,Starita,L.,Stone,J.,Vandermeer,M.,Weil,A.A.,Wolf,C.R.,Chu,H.Y.,Naleway,A.L.	The Brotman Baty Institute for Precision Medicine	A.D.5.2	GA2.3.5	0.0	good	43130	26	15001	0.9131691297208538	1.0	1.0	2022.927397260274
OR522484	OR522484.1	RSV-A/human/USA/WA-S23771/2022	2022-12-02	North America	USA	Washington	King County WA	Homo sapiens	2023-10-11		Frazar et al.	Frazar,C.D.,Lee,J.,Ryke,E.,Gamboa,L.,McDermot,E.,Kolar,T.,Han,P.D.,Sibley,T.R.,Reinhart,D.,Grindstaff,S.,Truong,M.,Babu,T.M.,Feldstein,L.R.,Saydah,S.,Briggs-Hagen,M.,Casto,A.,Ehmen,B.,Englund,J.A.,Fortmann,S.P.,Kuntz,J.L.,Lockwood,T.,Midgley,C.M.,Mularski,R.A.,Ogilvie,T.,Reich,S.,Schmidt,M.A.,Smith,N.,Starita,L.,Stone,J.,Vandermeer,M.,Weil,A.A.,Wolf,C.R.,Chu,H.Y.,Naleway,A.L.	The Brotman Baty Institute for Precision Medicine	A.D.5.2	GA2.3.5	0.0	good	44244	25	15159	0.9699178981937604	1.0	1.0	2022.9191780821918
OR522491	OR522491.1	RSV-A/human/USA/OR-S23778/2022	2022-12-06	North America	USA	Oregon	Clackamas County	Homo sapiens	2023-10-11		Frazar et al.	Frazar,C.D.,Lee,J.,Ryke,E.,Gamboa,L.,McDermot,E.,Kolar,T.,Han,P.D.,Sibley,T.R.,Reinhart,D.,Grindstaff,S.,Truong,M.,Babu,T.M.,Feldstein,L.R.,Saydah,S.,Briggs-Hagen,M.,Casto,A.,Ehmen,B.,Englund,J.A.,Fortmann,S.P.,Kuntz,J.L.,Lockwood,T.,Midgley,C.M.,Mularski,R.A.,Ogilvie,T.,Reich,S.,Schmidt,M.A.,Smith,N.,Starita,L.,Stone,J.,Vandermeer,M.,Weil,A.A.,Wolf,C.R.,Chu,H.Y.,Naleway,A.L.	The Brotman Baty Institute for Precision Medicine	A.D.1.8	GA2.3.5	0.0	good	44664	25	15222	0.994351395730706	1.0	1.0	2022.9301369863015
OR522498	OR522498.1	RSV-A/human/USA/WA-S23785/2022	2022-10-18	North America	USA	Washington	King County WA	Homo sapiens	2023-10-11		Frazar et al.	Frazar,C.D.,Lee,J.,Ryke,E.,Gamboa,L.,McDermot,E.,Kolar,T.,Han,P.D.,Sibley,T.R.,Reinhart,D.,Grindstaff,S.,Truong,M.,Babu,T.M.,Feldstein,L.R.,Saydah,S.,Briggs-Hagen,M.,Casto,A.,Ehmen,B.,Englund,J.A.,Fortmann,S.P.,Kuntz,J.L.,Lockwood,T.,Midgley,C.M.,Mularski,R.A.,Ogilvie,T.,Reich,S.,Schmidt,M.A.,Smith,N.,Starita,L.,Stone,J.,Vandermeer,M.,Weil,A.A.,Wolf,C.R.,Chu,H.Y.,Naleway,A.L.	The Brotman Baty Institute for Precision Medicine	A.D.1.8	GA2.3.5	0.0	good	43245	85	15038	0.9284729064039408	1.0	1.0	2022.795890410959
OR522508	OR522508.1	RSV-A/human/USA/OR-S23795/2023	2023-01-23	North America	USA	Oregon	Clackamas County	Homo sapiens	2023-10-11		Frazar et al.	Frazar,C.D.,Lee,J.,Ryke,E.,Gamboa,L.,McDermot,E.,Kolar,T.,Han,P.D.,Sibley,T.R.,Reinhart,D.,Grindstaff,S.,Truong,M.,Babu,T.M.,Feldstein,L.R.,Saydah,S.,Briggs-Hagen,M.,Casto,A.,Ehmen,B.,Englund,J.A.,Fortmann,S.P.,Kuntz,J.L.,Lockwood,T.,Midgley,C.M.,Mularski,R.A.,Ogilvie,T.,Reich,S.,Schmidt,M.A.,Smith,N.,Starita,L.,Stone,J.,Vandermeer,M.,Weil,A.A.,Wolf,C.R.,Chu,H.Y.,Naleway,A.L.	The Brotman Baty Institute for Precision Medicine	A.D.5.2	GA2.3.5	0.0	good	44693	25	15197	0.9965188834154352	1.0	1.0	2023.0616438356165
OR522511	OR522511.1	RSV-A/human/USA/OR-S23798/2023	2023-01-10	North America	USA	Oregon	Multnomah County OR	Homo sapiens	2023-10-11		Frazar et al.	Frazar,C.D.,Lee,J.,Ryke,E.,Gamboa,L.,McDermot,E.,Kolar,T.,Han,P.D.,Sibley,T.R.,Reinhart,D.,Grindstaff,S.,Truong,M.,Babu,T.M.,Feldstein,L.R.,Saydah,S.,Briggs-Hagen,M.,Casto,A.,Ehmen,B.,Englund,J.A.,Fortmann,S.P.,Kuntz,J.L.,Lockwood,T.,Midgley,C.M.,Mularski,R.A.,Ogilvie,T.,Reich,S.,Schmidt,M.A.,Smith,N.,Starita,L.,Stone,J.,Vandermeer,M.,Weil,A.A.,Wolf,C.R.,Chu,H.Y.,Naleway,A.L.	The Brotman Baty Institute for Precision Medicine	A.D.5.2	GA2.3.5	0.0	good	44811	15	15222	0.9988834154351396	1.0	1.0	2023.0260273972603
OR522515	OR522515.1	RSV-A/human/USA/OR-S23802/2022	2022-11-13	North America	USA	Oregon	Washington County OR	Homo sapiens	2023-10-11		Frazar et al.	Frazar,C.D.,Lee,J.,Ryke,E.,Gamboa,L.,McDermot,E.,Kolar,T.,Han,P.D.,Sibley,T.R.,Reinhart,D.,Grindstaff,S.,Truong,M.,Babu,T.M.,Feldstein,L.R.,Saydah,S.,Briggs-Hagen,M.,Casto,A.,Ehmen,B.,Englund,J.A.,Fortmann,S.P.,Kuntz,J.L.,Lockwood,T.,Midgley,C.M.,Mularski,R.A.,Ogilvie,T.,Reich,S.,Schmidt,M.A.,Smith,N.,Starita,L.,Stone,J.,Vandermeer,M.,Weil,A.A.,Wolf,C.R.,Chu,H.Y.,Naleway,A.L.	The Brotman Baty Institute for Precision Medicine	A.D.5.2	GA2.3.5	0.0	good	43509	90	15159	0.9230870279146142	1.0	1.0	2022.8671232876711
OR522521	OR522521.1	RSV-A/human/USA/OR-S23808/2022	2022-12-11	North America	USA	Oregon	Multnomah County OR	Homo sapiens	2023-10-11		Frazar et al.	Frazar,C.D.,Lee,J.,Ryke,E.,Gamboa,L.,McDermot,E.,Kolar,T.,Han,P.D.,Sibley,T.R.,Reinhart,D.,Grindstaff,S.,Truong,M.,Babu,T.M.,Feldstein,L.R.,Saydah,S.,Briggs-Hagen,M.,Casto,A.,Ehmen,B.,Englund,J.A.,Fortmann,S.P.,Kuntz,J.L.,Lockwood,T.,Midgley,C.M.,Mularski,R.A.,Ogilvie,T.,Reich,S.,Schmidt,M.A.,Smith,N.,Starita,L.,Stone,J.,Vandermeer,M.,Weil,A.A.,Wolf,C.R.,Chu,H.Y.,Naleway,A.L.	The Brotman Baty Institute for Precision Medicine	A.D.1	GA2.3.5	0.0	good	44787	3	15222	0.999671592775041	1.0	1.0	2022.9438356164383
OR522528	OR522528.1	RSV-A/human/USA/WA-S23815/2023	2023-01-31	North America	USA	Washington	King County WA	Homo sapiens	2023-10-11		Frazar et al.	Frazar,C.D.,Lee,J.,Ryke,E.,Gamboa,L.,McDermot,E.,Kolar,T.,Han,P.D.,Sibley,T.R.,Reinhart,D.,Grindstaff,S.,Truong,M.,Babu,T.M.,Feldstein,L.R.,Saydah,S.,Briggs-Hagen,M.,Casto,A.,Ehmen,B.,Englund,J.A.,Fortmann,S.P.,Kuntz,J.L.,Lockwood,T.,Midgley,C.M.,Mularski,R.A.,Ogilvie,T.,Reich,S.,Schmidt,M.A.,Smith,N.,Starita,L.,Stone,J.,Vandermeer,M.,Weil,A.A.,Wolf,C.R.,Chu,H.Y.,Naleway,A.L.	The Brotman Baty Institute for Precision Medicine	A.D.5.2	GA2.3.5	0.0	good	44380	25	15164	0.979704433497537	1.0	1.0	2023.0835616438355
OR601473	OR601473.1	RSV-A/human/USA/WA-S24023/2022	2022-10-16	North America	USA	Washington	King County WA	Homo sapiens	2023-10-28		Frazar et al.	Frazar,C.D.,Lee,J.,Ryke,E.,Gamboa,L.,McDermot,E.,Kolar,T.,Han,P.D.,Sibley,T.R.,Reinhart,D.,Grindstaff,S.,Truong,M.,Babu,T.M.,Feldstein,L.R.,Saydah,S.,Briggs-Hagen,M.,Casto,A.,Ehmen,B.,Englund,J.A.,Fortmann,S.P.,Kuntz,J.L.,Lockwood,T.,Midgley,C.M.,Mularski,R.A.,Ogilvie,T.,Reich,S.,Schmidt,M.A.,Smith,N.,Starita,L.,Stone,J.,Vandermeer,M.,Weil,A.A.,Wolf,C.R.,Chu,H.Y.,Naleway,A.L.	The Brotman Baty Institute for Precision Medicine	A.D.1.8	GA2.3.5	0.0	good	43380	61	15039	0.9352380952380952	1.0	1.0	2022.7904109589042
OR601479	OR601479.1	RSV-A/human/USA/WA-S24029/2023	2023-02-12	North America	USA	Washington	Snohomish County	Homo sapiens	2023-10-28		Frazar et al.	Frazar,C.D.,Lee,J.,Ryke,E.,Gamboa,L.,McDermot,E.,Kolar,T.,Han,P.D.,Sibley,T.R.,Reinhart,D.,Grindstaff,S.,Truong,M.,Babu,T.M.,Feldstein,L.R.,Saydah,S.,Briggs-Hagen,M.,Casto,A.,Ehmen,B.,Englund,J.A.,Fortmann,S.P.,Kuntz,J.L.,Lockwood,T.,Midgley,C.M.,Mularski,R.A.,Ogilvie,T.,Reich,S.,Schmidt,M.A.,Smith,N.,Starita,L.,Stone,J.,Vandermeer,M.,Weil,A.A.,Wolf,C.R.,Chu,H.Y.,Naleway,A.L.	The Brotman Baty Institute for Precision Medicine	A.D.1	GA2.3.5	1.0	good	44734	25	15222	0.9982266009852216	1.0	1.0	2023.1164383561643
OR666505	OR666505.1	RSVA/YC17100/NX/CHN/2017.10.26	2017-10-26	Asia	China			Homo sapiens	2023-11-04		Li et al.	Li,F.,Zhu,Y.,Chen,X.	Beijing Children's Hospital, Capital Medical University, Laboratory of Infection and Virology	A.D.3	GA2.3.5	0.0	good	45007	1	15225	1.0	1.0	1.0	2017.817808219178
OR666508	OR666508.1	RSVA/BCH18222/BJ/CHN/2018.12.11	2018-12-11	Asia	China			Homo sapiens	2023-11-04		Li et al.	Li,F.,Zhu,Y.,Chen,X.	Beijing Children's Hospital, Capital Medical University, Laboratory of Infection and Virology	A.D.3	GA2.3.5	0.0	good	45027	1	15225	1.0	1.0	1.0	2018.9438356164383
OR666509	OR666509.1	RSVA/BCH18253/BJ/CHN/2018.12.20	2018-12-20	Asia	China			Homo sapiens	2023-11-04		Li et al.	Li,F.,Zhu,Y.,Chen,X.	Beijing Children's Hospital, Capital Medical University, Laboratory of Infection and Virology	A.D.3	GA2.3.5	0.0	good	44995	1	15225	1.0	1.0	1.0	2018.968493150685
OR666506	OR666506.1	RSVA/WZ17004/ZJ/CHN/2017.12.19	2017-12-19	Asia	China			Homo sapiens	2023-11-04		Li et al.	Li,F.,Zhu,Y.,Chen,X.	Beijing Children's Hospital, Capital Medical University, Laboratory of Infection and Virology	A.D	GA2.3.5	0.0	good	45107	1	15225	1.0	1.0	1.0	2017.9657534246576
OR666507	OR666507.1	RSVA/WZ17011/ZJ/CHN/2017.12.26	2017-12-26	Asia	China			Homo sapiens	2023-11-04		Li et al.	Li,F.,Zhu,Y.,Chen,X.	Beijing Children's Hospital, Capital Medical University, Laboratory of Infection and Virology	A.D	GA2.3.5	0.36	good	45059	1	15225	1.0	1.0	1.0	2017.9849315068493
OR666515	OR666515.1	RSVA/20190061/BJ/CHN/2019.01.15	2019-01-15	Asia	China			Homo sapiens	2023-11-04		Li et al.	Li,F.,Zhu,Y.,Chen,X.	Beijing Children's Hospital, Capital Medical University, Laboratory of Infection and Virology	A.D	GA2.3.5	0.0	good	45067	1	15225	1.0	1.0	1.0	2019.0397260273974
OR666517	OR666517.1	RSVA/20190065/BJ/CHN/2019.01.15	2019-01-15	Asia	China			Homo sapiens	2023-11-04		Li et al.	Li,F.,Zhu,Y.,Chen,X.	Beijing Children's Hospital, Capital Medical University, Laboratory of Infection and Virology	A.D	GA2.3.5	2.777778	good	44983	1	15193	0.9978981937602628	1.0	1.0	2019.0397260273974
OR666532	OR666532.1	RSVA/20190233/BJ/CHN/2019.02.03	2019-02-03	Asia	China			Homo sapiens	2023-11-04		Li et al.	Li,F.,Zhu,Y.,Chen,X.	Beijing Children's Hospital, Capital Medical University, Laboratory of Infection and Virology	A.D.3	GA2.3.5	0.0	good	44987	1	15225	1.0	1.0	1.0	2019.0917808219178
OR666534	OR666534.1	RSVA/20190508/BJ/CHN/2019.04.19	2019-04-19	Asia	China			Homo sapiens	2023-11-04		Li et al.	Li,F.,Zhu,Y.,Chen,X.	Beijing Children's Hospital, Capital Medical University, Laboratory of Infection and Virology	A.D.3	GA2.3.5	0.0	good	44991	1	15225	1.0	1.0	1.0	2019.2972602739726
OR666546	OR666546.1	RSVA/6818/BJ/CHN/2019.12.01	2019-12-01	Asia	China			Homo sapiens	2023-11-04		Li et al.	Li,F.,Zhu,Y.,Chen,X.	Beijing Children's Hospital, Capital Medical University, Laboratory of Infection and Virology	A.D.3	GA2.3.5	0.0	good	45019	1	15225	1.0	1.0	1.0	2019.9164383561645
OR666544	OR666544.1	RSVA/6759/BJ/CHN/2019.12.01	2019-12-01	Asia	China			Homo sapiens	2023-11-04		Li et al.	Li,F.,Zhu,Y.,Chen,X.	Beijing Children's Hospital, Capital Medical University, Laboratory of Infection and Virology	A.D.3	GA2.3.5	0.0	good	45011	1	15225	1.0	1.0	1.0	2019.9164383561645
OR666563	OR666563.1	RSVA/20200255/BJ/CHN/2020.02.06	2020-02-06	Asia	China			Homo sapiens	2023-11-04		Li et al.	Li,F.,Zhu,Y.,Chen,X.	Beijing Children's Hospital, Capital Medical University, Laboratory of Infection and Virology	A.D	GA2.3.5	0.0	good	44909	14	15224	0.999080459770115	1.0	1.0	2020.0997267759562
OR666568	OR666568.1	RSVA/20200306/BJ/CHN/2020.02.13	2020-02-13	Asia	China			Homo sapiens	2023-11-04		Li et al.	Li,F.,Zhu,Y.,Chen,X.	Beijing Children's Hospital, Capital Medical University, Laboratory of Infection and Virology	A.D	GA2.3.5	1.137778	good	44540	16	15095	0.9904761904761904	1.0	1.0	2020.1188524590164
OR666565	OR666565.1	RSVA/20200284/BJ/CHN/2020.02.11	2020-02-11	Asia	China			Homo sapiens	2023-11-04		Li et al.	Li,F.,Zhu,Y.,Chen,X.	Beijing Children's Hospital, Capital Medical University, Laboratory of Infection and Virology	A.D.3	GA2.3.5	0.0	good	44870	33	15220	0.9975697865353038	1.0	1.0	2020.113387978142
OR795292	OR795292.1	hRSV/A/Germany/00-02128/2000	2000-02-11	Europe	Germany			Homo sapiens	2024-02-13		Kondgen et al.	Kondgen,S.,Reiche,J.	Robert Koch Institut	A.3	GA2.3.2b	0.0	good	44185	1	15215	0.999343185550082	1.0	1.0	2000.113387978142
OR795295	OR795295.1	hRSV/A/Germany/00-02433/2000	2000-03-07	Europe	Germany			Homo sapiens	2024-02-13		Kondgen et al.	Kondgen,S.,Reiche,J.	Robert Koch Institut	A.2.1.1	GA3.0.2	0.0	good	42767	1	15215	0.999343185550082	1.0	1.0	2000.181693989071
OR795293	OR795293.1	hRSV/A/Germany/00-02234/2000	2000-02-17	Europe	Germany			Homo sapiens	2024-02-13		Kondgen et al.	Kondgen,S.,Reiche,J.	Robert Koch Institut	A.3	GA2.3.1	0.0	good	44189	1	15215	0.999343185550082	1.0	1.0	2000.129781420765
OR795294	OR795294.1	hRSV/A/Germany/00-02321/2000	2000-02-23	Europe	Germany			Homo sapiens	2024-02-13		Kondgen et al.	Kondgen,S.,Reiche,J.	Robert Koch Institut	A.2.1	GA3.0.2	0.0	good	42730	1	15215	0.999343185550082	1.0	1.0	2000.146174863388
OR795296	OR795296.1	hRSV/A/Germany/00-02504/2000	2000-03-20	Europe	Germany			Homo sapiens	2024-02-13		Kondgen et al.	Kondgen,S.,Reiche,J.	Robert Koch Institut	A.3	GA2.2	0.0	good	42972	1	15214	0.9992775041050904	1.0	1.0	2000.217213114754
OR795298	OR795298.1	hRSV/A/Germany/01-01609/2001	2001-02-05	Europe	Germany			Homo sapiens	2024-02-13		Kondgen et al.	Kondgen,S.,Reiche,J.	Robert Koch Institut	A.2.1	GA3.0.2	0.0	good	42757	1	15215	0.999343185550082	1.0	1.0	2001.0972602739726
OR795297	OR795297.1	hRSV/A/Germany/01-01600/2001	2001-02-05	Europe	Germany			Homo sapiens	2024-02-13		Kondgen et al.	Kondgen,S.,Reiche,J.	Robert Koch Institut	A.3	GA2.3.1	0.0	good	44105	1	15215	0.999343185550082	1.0	1.0	2001.0972602739726
OR795299	OR795299.1	hRSV/A/Germany/01-02630/2001	2001-03-27	Europe	Germany			Homo sapiens	2024-02-13		Kondgen et al.	Kondgen,S.,Reiche,J.	Robert Koch Institut	A.3	GA2.3.2b	0.0	good	44129	1	15215	0.999343185550082	1.0	1.0	2001.2342465753425
OR795300	OR795300.1	hRSV/A/Germany/01-02679/2001	2001-03-29	Europe	Germany			Homo sapiens	2024-02-13		Kondgen et al.	Kondgen,S.,Reiche,J.	Robert Koch Institut	A.2.1.1	GA3.0.2	0.0	good	42735	1	15215	0.999343185550082	1.0	1.0	2001.2397260273972
OR795301	OR795301.1	hRSV/A/Germany/02-00980/2002	2002-01-29	Europe	Germany			Homo sapiens	2024-02-13		Kondgen et al.	Kondgen,S.,Reiche,J.	Robert Koch Institut	A.2.1	GA3.0.2	0.0	good	42733	1	15215	0.999343185550082	1.0	1.0	2002.0780821917808
OR795304	OR795304.1	hRSV/A/Germany/02-02688/2002	2002-04-25	Europe	Germany			Homo sapiens	2024-02-13		Kondgen et al.	Kondgen,S.,Reiche,J.	Robert Koch Institut	A.3	GA2.3.2b	0.0	good	44039	1	15215	0.999343185550082	1.0	1.0	2002.313698630137
OR795303	OR795303.1	hRSV/A/Germany/02-02431/2002	2002-03-26	Europe	Germany			Homo sapiens	2024-02-13		Kondgen et al.	Kondgen,S.,Reiche,J.	Robert Koch Institut	A.3	GA2.3.1	0.0	good	43951	1	15215	0.999343185550082	1.0	1.0	2002.231506849315
OR795302	OR795302.1	hRSV/A/Germany/02-01284/2002	2002-02-16	Europe	Germany			Homo sapiens	2024-02-13		Kondgen et al.	Kondgen,S.,Reiche,J.	Robert Koch Institut	A.2.1.1	GA3.0.2	0.0	good	42658	16	15213	0.9982266009852216	1.0	1.0	2002.127397260274
OR795306	OR795306.1	hRSV/A/Germany/03-00557/2002	2002-12-12	Europe	Germany			Homo sapiens	2024-02-13		Kondgen et al.	Kondgen,S.,Reiche,J.	Robert Koch Institut	A.2.1.1	GA3.0.2	0.0	good	42650	1	15215	0.999343185550082	1.0	1.0	2002.9465753424658
OR795312	OR795312.1	hRSV/A/Germany/04-01960/2004	2004-02-17	Europe	Germany			Homo sapiens	2024-02-13		Kondgen et al.	Kondgen,S.,Reiche,J.	Robert Koch Institut	A.3	GA2.3.2b	0.0	good	44009	1	15215	0.999343185550082	1.0	1.0	2004.129781420765
OR795305	OR795305.1	hRSV/A/Germany/03-00082/2002	2002-10-25	Europe	Germany			Homo sapiens	2024-02-13		Kondgen et al.	Kondgen,S.,Reiche,J.	Robert Koch Institut	A.3	GA2.2	0.0	good	43009	1	15211	0.999080459770115	1.0	1.0	2002.8150684931506
OR795308	OR795308.1	hRSV/A/Germany/03-01038/2003	2003-02-04	Europe	Germany			Homo sapiens	2024-02-13		Kondgen et al.	Kondgen,S.,Reiche,J.	Robert Koch Institut	A.2.1	GA3.0.2	0.0	good	42693	16	15214	0.9982922824302136	1.0	1.0	2003.0945205479452
OR795307	OR795307.1	hRSV/A/Germany/03-00597/2002	2002-12-16	Europe	Germany			Homo sapiens	2024-02-13		Kondgen et al.	Kondgen,S.,Reiche,J.	Robert Koch Institut	A.3	GA2.3.2	0.0	good	44036	1	15215	0.999343185550082	1.0	1.0	2002.9575342465753
OR795314	OR795314.1	hRSV/A/Germany/05-00877/2005	2005-01-06	Europe	Germany			Homo sapiens	2024-02-13		Kondgen et al.	Kondgen,S.,Reiche,J.	Robert Koch Institut	A.3	GA2.3.1	0.0	good	43909	1	15215	0.999343185550082	1.0	1.0	2005.0150684931507
OR795311	OR795311.1	hRSV/A/Germany/04-01889/2004	2004-02-15	Europe	Germany			Homo sapiens	2024-02-13		Kondgen et al.	Kondgen,S.,Reiche,J.	Robert Koch Institut	A.2.1.1	GA3.0.2	0.0	good	42645	1	15215	0.999343185550082	1.0	1.0	2004.1243169398906
OR795310	OR795310.1	hRSV/A/Germany/04-01612/2004	2004-02-07	Europe	Germany			Homo sapiens	2024-02-13		Kondgen et al.	Kondgen,S.,Reiche,J.	Robert Koch Institut	A.2.1.1	GA3.0.2	0.0	good	42671	1	15215	0.999343185550082	1.0	1.0	2004.1024590163934
OR795309	OR795309.1	hRSV/A/Germany/04-01144/2004	2004-01-21	Europe	Germany			Homo sapiens	2024-02-13		Kondgen et al.	Kondgen,S.,Reiche,J.	Robert Koch Institut	A.2.1	GA3.0.2	0.0	good	42701	1	15215	0.999343185550082	1.0	1.0	2004.0560109289618
OR795316	OR795316.1	hRSV/A/Germany/05-01521/2005	2005-02-03	Europe	Germany			Homo sapiens	2024-02-13		Kondgen et al.	Kondgen,S.,Reiche,J.	Robert Koch Institut	A.2.1	GA3.0.2	0.0	good	42645	1	15215	0.999343185550082	1.0	1.0	2005.0917808219178
OR795313	OR795313.1	hRSV/A/Germany/05-00643/2004	2004-12-17	Europe	Germany			Homo sapiens	2024-02-13		Kondgen et al.	Kondgen,S.,Reiche,J.	Robert Koch Institut	A.2.1.1	GA3.0.2	0.0	good	42669	1	15215	0.999343185550082	1.0	1.0	2004.9603825136612
OR795317	OR795317.1	hRSV/A/Germany/05-02141/2005	2005-02-14	Europe	Germany			Homo sapiens	2024-02-13		Kondgen et al.	Kondgen,S.,Reiche,J.	Robert Koch Institut	A.2.1	GA3.0.2	0.0	good	42689	1	15215	0.999343185550082	1.0	1.0	2005.1219178082192
OR795320	OR795320.1	hRSV/A/Germany/06-02671/2006	2006-03-29	Europe	Germany			Homo sapiens	2024-02-13		Kondgen et al.	Kondgen,S.,Reiche,J.	Robert Koch Institut	A.2.1.1	GA3.0.2	0.0	good	42557	1	15215	0.999343185550082	1.0	1.0	2006.2397260273972
OR795315	OR795315.1	hRSV/A/Germany/05-00962/2005	2005-01-11	Europe	Germany			Homo sapiens	2024-02-13		Kondgen et al.	Kondgen,S.,Reiche,J.	Robert Koch Institut	A.3	GA2.3.2b	0.0	good	43985	1	15214	0.9992775041050904	1.0	1.0	2005.0287671232877
OR795325	OR795325.1	hRSV/A/Germany/08-02097/2008	2008-02-25	Europe	Germany			Homo sapiens	2024-02-13		Kondgen et al.	Kondgen,S.,Reiche,J.	Robert Koch Institut	A.2.1.1	GA3.0.2	0.0	good	42549	1	15215	0.999343185550082	1.0	1.0	2008.1516393442623
OR795324	OR795324.1	hRSV/A/Germany/07-02759/2007	2007-03-05	Europe	Germany			Homo sapiens	2024-02-13		Kondgen et al.	Kondgen,S.,Reiche,J.	Robert Koch Institut	A.2.1	GA3.0.2	0.0	good	42615	1	15214	0.9992775041050904	1.0	1.0	2007.1739726027397
OR795318	OR795318.1	hRSV/A/Germany/06-01244/2006	2006-01-27	Europe	Germany			Homo sapiens	2024-02-13		Kondgen et al.	Kondgen,S.,Reiche,J.	Robert Koch Institut	A.3.1	GA2.3.3	0.0	good	44641	1	15215	0.999343185550082	1.0	1.0	2006.072602739726
OR795319	OR795319.1	hRSV/A/Germany/06-01417/2006	2006-02-10	Europe	Germany			Homo sapiens	2024-02-13		Kondgen et al.	Kondgen,S.,Reiche,J.	Robert Koch Institut	A.2.1	GA3.0.2	0.0	good	42647	1	15215	0.999343185550082	1.0	1.0	2006.1109589041096
OR795326	OR795326.1	hRSV/A/Germany/08-02984/2008	2008-04-02	Europe	Germany			Homo sapiens	2024-02-13		Kondgen et al.	Kondgen,S.,Reiche,J.	Robert Koch Institut	A.2.1	GA3.0.2	0.0	good	42534	1	15215	0.999343185550082	1.0	1.0	2008.2527322404371
OR795321	OR795321.1	hRSV/A/Germany/06-03114/2006	2006-04-11	Europe	Germany			Homo sapiens	2024-02-13		Kondgen et al.	Kondgen,S.,Reiche,J.	Robert Koch Institut	A.3	GA2.3.1	0.0	good	43881	1	15215	0.999343185550082	1.0	1.0	2006.2753424657535
OR795323	OR795323.1	hRSV/A/Germany/07-01529/2007	2007-02-12	Europe	Germany			Homo sapiens	2024-02-13		Kondgen et al.	Kondgen,S.,Reiche,J.	Robert Koch Institut	A.2.1.1	GA3.0.2	0.0	good	42591	1	15215	0.999343185550082	1.0	1.0	2007.1164383561643
OR795322	OR795322.1	hRSV/A/Germany/07-01176/2007	2007-02-05	Europe	Germany			Homo sapiens	2024-02-13		Kondgen et al.	Kondgen,S.,Reiche,J.	Robert Koch Institut	A.3	GA2.3.2b	0.0	good	43962	1	15215	0.999343185550082	1.0	1.0	2007.0972602739726
OR795327	OR795327.1	hRSV/A/Germany/08-03173/2008	2008-04-22	Europe	Germany			Homo sapiens	2024-02-13		Kondgen et al.	Kondgen,S.,Reiche,J.	Robert Koch Institut	A.3.1	GA2.3.3	0.0	good	44645	1	15215	0.999343185550082	1.0	1.0	2008.3073770491803
OR795329	OR795329.1	hRSV/A/Germany/10-03936/2010	2010-03-29	Europe	Germany			Homo sapiens	2024-02-13		Kondgen et al.	Kondgen,S.,Reiche,J.	Robert Koch Institut	A.3.1	GA2.3.3	0.16	good	44503	1	15215	0.999343185550082	1.0	1.0	2010.2397260273972
OR795333	OR795333.1	hRSV/A/Germany/11-01119/2011	2011-01-10	Europe	Germany			Homo sapiens	2024-02-13		Kondgen et al.	Kondgen,S.,Reiche,J.	Robert Koch Institut	A.3.1.1	GA2.3.3	0.0	good	44868	1	15212	0.9991461412151068	1.0	1.0	2011.0260273972603
OR795332	OR795332.1	hRSV/A/Germany/11-00953/2011	2011-01-10	Europe	Germany			Homo sapiens	2024-02-13		Kondgen et al.	Kondgen,S.,Reiche,J.	Robert Koch Institut	A.3.1	GA2.3.3	0.0	good	44410	1	15215	0.999343185550082	1.0	1.0	2011.0260273972603
OR795328	OR795328.1	hRSV/A/Germany/09-03766/2009	2009-02-18	Europe	Germany			Homo sapiens	2024-02-13		Kondgen et al.	Kondgen,S.,Reiche,J.	Robert Koch Institut	A.3.1	GA2.3.3	0.0	good	44722	1	15212	0.9991461412151068	1.0	1.0	2009.1328767123289
OR795334	OR795334.1	hRSV/A/Germany/11-01819/2011	2011-01-26	Europe	Germany			Homo sapiens	2024-02-13		Kondgen et al.	Kondgen,S.,Reiche,J.	Robert Koch Institut	A.3.1	GA2.3.3	0.0	good	44598	1	15212	0.9991461412151068	1.0	1.0	2011.0698630136985
OR795331	OR795331.1	hRSV/A/Germany/11-00752/2010	2010-12-27	Europe	Germany			Homo sapiens	2024-02-13		Kondgen et al.	Kondgen,S.,Reiche,J.	Robert Koch Institut	A.3	GA2.3.2b	0.0	good	43782	1	15214	0.9992775041050904	1.0	1.0	2010.9876712328767
OR795337	OR795337.1	hRSV/A/Germany/12-02624/2012	2012-03-19	Europe	Germany			Homo sapiens	2024-02-13		Kondgen et al.	Kondgen,S.,Reiche,J.	Robert Koch Institut	A.3.1.1	GA2.3.3	0.0	good	44828	1	15210	0.9990147783251232	1.0	1.0	2012.214480874317
OR795339	OR795339.1	hRSV/A/Germany/13-00953/2012	2012-12-19	Europe	Germany			Homo sapiens	2024-02-13		Kondgen et al.	Kondgen,S.,Reiche,J.	Robert Koch Institut	A.D	GA2.3.5	0.0	good	45215	1	15225	1.0	1.0	1.0	2012.9658469945355
OR795344	OR795344.1	hRSV/A/Germany/14-01559/2014	2014-02-03	Europe	Germany			Homo sapiens	2024-02-13		Kondgen et al.	Kondgen,S.,Reiche,J.	Robert Koch Institut	A.D	GA2.3.5	0.0	good	45175	1	15225	1.0	1.0	1.0	2014.0917808219178
OR795346	OR795346.1	hRSV/A/Germany/14-02421/2014	2014-03-03	Europe	Germany			Homo sapiens	2024-02-13		Kondgen et al.	Kondgen,S.,Reiche,J.	Robert Koch Institut	A.D	GA2.3.5	0.0	good	45203	1	15225	1.0	1.0	1.0	2014.168493150685
OR795340	OR795340.1	hRSV/A/Germany/13-01268/2013	2013-01-07	Europe	Germany			Homo sapiens	2024-02-13		Kondgen et al.	Kondgen,S.,Reiche,J.	Robert Koch Institut	A.3.1	GA2.3.3	0.0	good	44659	1	15215	0.999343185550082	1.0	1.0	2013.017808219178
OR795345	OR795345.1	hRSV/A/Germany/14-02165/2014	2014-02-21	Europe	Germany			Homo sapiens	2024-02-13		Kondgen et al.	Kondgen,S.,Reiche,J.	Robert Koch Institut	A.D.2.2	GA2.3.5	0.0	good	45325	1	15209	0.9989490968801312	1.0	1.0	2014.141095890411
OR795348	OR795348.1	hRSV/A/Germany/15-00817/2014	2014-12-02	Europe	Germany			Homo sapiens	2024-02-13		Kondgen et al.	Kondgen,S.,Reiche,J.	Robert Koch Institut	A.D	GA2.3.5	0.0	good	45132	1	15225	1.0	1.0	1.0	2014.9191780821918
OR795347	OR795347.1	hRSV/A/Germany/14-02853/2014	2014-03-18	Europe	Germany			Homo sapiens	2024-02-13		Kondgen et al.	Kondgen,S.,Reiche,J.	Robert Koch Institut	A.D	GA2.3.5	0.0	good	45207	1	15225	1.0	1.0	1.0	2014.2095890410958
OR795349	OR795349.1	hRSV/A/Germany/15-01353/2014	2014-12-27	Europe	Germany			Homo sapiens	2024-02-13		Kondgen et al.	Kondgen,S.,Reiche,J.	Robert Koch Institut	A.D	GA2.3.5	56.25	mediocre	45167	1	15225	1.0	1.0	1.0	2014.9876712328767
OR795350	OR795350.1	hRSV/A/Germany/15-01870/2015	2015-01-20	Europe	Germany			Homo sapiens	2024-02-13		Kondgen et al.	Kondgen,S.,Reiche,J.	Robert Koch Institut	A.D	GA2.3.5	0.0	good	45099	1	15225	1.0	1.0	1.0	2015.0534246575342
OR795356	OR795356.1	hRSV/A/Germany/17-01161/2016	2016-12-13	Europe	Germany			Homo sapiens	2024-02-13		Kondgen et al.	Kondgen,S.,Reiche,J.	Robert Koch Institut	A.D.1	GA2.3.5	0.0	good	45035	1	15223	0.9998686371100164	1.0	1.0	2016.9494535519125
OR795358	OR795358.1	hRSV/A/Germany/17-02326/2017	2017-01-23	Europe	Germany			Homo sapiens	2024-02-13		Kondgen et al.	Kondgen,S.,Reiche,J.	Robert Koch Institut	A.D	GA2.3.5	0.0	good	45071	1	15225	1.0	1.0	1.0	2017.0616438356165
OR795355	OR795355.1	hRSV/A/Germany/17-00876/2016	2016-11-30	Europe	Germany			Homo sapiens	2024-02-13		Kondgen et al.	Kondgen,S.,Reiche,J.	Robert Koch Institut	A.D.5	GA2.3.5	0.0	good	44875	1	15168	0.9961904761904762	1.0	1.0	2016.9139344262296
OR795354	OR795354.1	hRSV/A/Germany/16-02403/2016	2016-02-25	Europe	Germany			Homo sapiens	2024-02-13		Kondgen et al.	Kondgen,S.,Reiche,J.	Robert Koch Institut	A.D	GA2.3.5	0.0	good	45074	1	15225	1.0	1.0	1.0	2016.1516393442623
OR795361	OR795361.1	hRSV/A/Germany/18-00988/2017	2017-11-24	Europe	Germany			Homo sapiens	2024-02-13		Kondgen et al.	Kondgen,S.,Reiche,J.	Robert Koch Institut	A.D.2.2.1	GA2.3.5	0.0	good	45571	1	15225	1.0	1.0	1.0	2017.8972602739725
OR795357	OR795357.1	hRSV/A/Germany/17-01795/2017	2017-01-09	Europe	Germany			Homo sapiens	2024-02-13		Kondgen et al.	Kondgen,S.,Reiche,J.	Robert Koch Institut	A.D.2.2	GA2.3.5	56.25	mediocre	45265	1	15225	1.0	1.0	1.0	2017.0232876712328
OR795366	OR795366.1	hRSV/A/Germany/18-05891/2018	2018-04-09	Europe	Germany			Homo sapiens	2024-02-13		Kondgen et al.	Kondgen,S.,Reiche,J.	Robert Koch Institut	A.D	GA2.3.5	0.0	good	45047	1	15225	1.0	1.0	1.0	2018.2698630136986
OR795368	OR795368.1	hRSV/A/Germany/19-00912/2018	2018-12-09	Europe	Germany			Homo sapiens	2024-02-13		Kondgen et al.	Kondgen,S.,Reiche,J.	Robert Koch Institut	A.D.3	GA2.3.5	0.0	good	44619	1	15107	0.9922495894909688	1.0	1.0	2018.9383561643835
OR795373	OR795373.1	hRSV/A/Germany/19-01507/2019	2019-01-14	Europe	Germany			Homo sapiens	2024-02-13		Kondgen et al.	Kondgen,S.,Reiche,J.	Robert Koch Institut	A.D.1	GA2.3.5	0.0	good	44357	15	15048	0.987454844006568	1.0	1.0	2019.0369863013698
OR795384	OR795384.1	hRSV/A/Germany/20-00993/2019	2019-12-16	Europe	Germany			Homo sapiens	2024-02-13		Kondgen et al.	Kondgen,S.,Reiche,J.	Robert Koch Institut	A.D	GA2.3.5	0.0	good	44990	1	15225	1.0	1.0	1.0	2019.9575342465753
OR795393	OR795393.1	hRSV/A/Germany/20-02446/2020	2020-02-17	Europe	Germany			Homo sapiens	2024-02-13		Kondgen et al.	Kondgen,S.,Reiche,J.	Robert Koch Institut	A.D	GA2.3.5	0.0	good	44647	3	15123	0.9931691297208538	1.0	1.0	2020.129781420765
OR795400	OR795400.1	hRSV/A/Germany/20-02689/2020	2020-02-21	Europe	Germany			Homo sapiens	2024-02-13		Kondgen et al.	Kondgen,S.,Reiche,J.	Robert Koch Institut	A.D	GA2.3.5	0.0	good	44889	1	15225	1.0	1.0	1.0	2020.1407103825136
OR795401	OR795401.1	hRSV/A/Germany/20-02702/2020	2020-02-24	Europe	Germany			Homo sapiens	2024-02-13		Kondgen et al.	Kondgen,S.,Reiche,J.	Robert Koch Institut	A.D	GA2.3.5	0.537778	good	44975	1	15225	1.0	1.0	1.0	2020.1489071038252
OR795410	OR795410.1	hRSV/A/Germany/20-03531/2020	2020-03-16	Europe	Germany			Homo sapiens	2024-02-13		Kondgen et al.	Kondgen,S.,Reiche,J.	Robert Koch Institut	A.D.5	GA2.3.5	0.0	good	44467	6	15082	0.9902791461412151	1.0	1.0	2020.2062841530055
OR795407	OR795407.1	hRSV/A/Germany/20-03302/2020	2020-03-09	Europe	Germany			Homo sapiens	2024-02-13		Kondgen et al.	Kondgen,S.,Reiche,J.	Robert Koch Institut	A.D.1	GA2.3.5	0.0	good	44820	1	15193	0.9978981937602628	1.0	1.0	2020.1871584699454
OR795411	OR795411.1	hRSV/A/Germany/20-03551/2020	2020-03-16	Europe	Germany			Homo sapiens	2024-02-13		Kondgen et al.	Kondgen,S.,Reiche,J.	Robert Koch Institut	A.D	GA2.3.5	56.25	mediocre	44865	1	15225	1.0	1.0	1.0	2020.2062841530055
OR795421	OR795421.1	hRSV/A/Germany/21-07326/2021	2021-09-28	Europe	Germany			Homo sapiens	2024-02-13		Kondgen et al.	Kondgen,S.,Reiche,J.	Robert Koch Institut	A.D.1	GA2.3.5	0.0	good	44832	1	15219	0.9996059113300492	1.0	1.0	2021.7410958904109
OR795419	OR795419.1	hRSV/A/Germany/21-07100/2021	2021-09-21	Europe	Germany			Homo sapiens	2024-02-13		Kondgen et al.	Kondgen,S.,Reiche,J.	Robert Koch Institut	A.D.5.2	GA2.3.5	0.0	good	44863	1	15225	1.0	1.0	1.0	2021.7219178082191
OR795417	OR795417.1	hRSV/A/Germany/21-07026/2021	2021-09-20	Europe	Germany			Homo sapiens	2024-02-13		Kondgen et al.	Kondgen,S.,Reiche,J.	Robert Koch Institut	A.D.5.2	GA2.3.5	0.0	good	44855	1	15225	1.0	1.0	1.0	2021.7191780821918
OR795420	OR795420.1	hRSV/A/Germany/21-07170/2021	2021-09-23	Europe	Germany			Homo sapiens	2024-02-13		Kondgen et al.	Kondgen,S.,Reiche,J.	Robert Koch Institut	A.D.3	GA2.3.5	0.0	good	44911	1	15225	1.0	1.0	1.0	2021.727397260274
OR795428	OR795428.1	hRSV/A/Germany/22-00458/2021	2021-10-13	Europe	Germany			Homo sapiens	2024-02-13		Kondgen et al.	Kondgen,S.,Reiche,J.	Robert Koch Institut	A.D.5	GA2.3.5	0.0	good	44811	1	15225	1.0	1.0	1.0	2021.782191780822
OR795426	OR795426.1	hRSV/A/Germany/22-00345/2021	2021-10-12	Europe	Germany			Homo sapiens	2024-02-13		Kondgen et al.	Kondgen,S.,Reiche,J.	Robert Koch Institut	A.D.3	GA2.3.5	0.0	good	44915	1	15225	1.0	1.0	1.0	2021.7794520547945
OR795425	OR795425.1	hRSV/A/Germany/22-00290/2021	2021-10-11	Europe	Germany			Homo sapiens	2024-02-13		Kondgen et al.	Kondgen,S.,Reiche,J.	Robert Koch Institut	A.D.5.2	GA2.3.5	0.0	good	44863	1	15225	1.0	1.0	1.0	2021.7767123287672
OR795433	OR795433.1	hRSV/A/Germany/22-00726/2021	2021-10-21	Europe	Germany			Homo sapiens	2024-02-13		Kondgen et al.	Kondgen,S.,Reiche,J.	Robert Koch Institut	A.D.5	GA2.3.5	0.0	good	44772	1	15219	0.9996059113300492	1.0	1.0	2021.804109589041
OR795432	OR795432.1	hRSV/A/Germany/22-00724/2021	2021-10-19	Europe	Germany			Homo sapiens	2024-02-13		Kondgen et al.	Kondgen,S.,Reiche,J.	Robert Koch Institut	A.D.3	GA2.3.5	0.0	good	44873	1	15225	1.0	1.0	1.0	2021.7986301369863
OR795434	OR795434.1	hRSV/A/Germany/22-00730/2021	2021-10-24	Europe	Germany			Homo sapiens	2024-02-13		Kondgen et al.	Kondgen,S.,Reiche,J.	Robert Koch Institut	A.D.3.1	GA2.3.5	0.0	good	44804	1	15225	1.0	1.0	1.0	2021.8123287671233
OR795430	OR795430.1	hRSV/A/Germany/22-00668/2021	2021-10-20	Europe	Germany			Homo sapiens	2024-02-13		Kondgen et al.	Kondgen,S.,Reiche,J.	Robert Koch Institut	A.D.5.2	GA2.3.5	0.0	good	44843	1	15225	1.0	1.0	1.0	2021.8013698630136
OR795440	OR795440.1	hRSV/A/Germany/22-00939/2021	2021-10-26	Europe	Germany			Homo sapiens	2024-02-13		Kondgen et al.	Kondgen,S.,Reiche,J.	Robert Koch Institut	A.D.5	GA2.3.5	0.0	good	44777	1	15225	1.0	1.0	1.0	2021.817808219178
OR795443	OR795443.1	hRSV/A/Germany/22-01153/2021	2021-10-28	Europe	Germany			Homo sapiens	2024-02-13		Kondgen et al.	Kondgen,S.,Reiche,J.	Robert Koch Institut	A.D.5	GA2.3.5	0.0	good	44819	1	15225	1.0	1.0	1.0	2021.823287671233
OR795447	OR795447.1	hRSV/A/Germany/22-01300/2021	2021-11-09	Europe	Germany			Homo sapiens	2024-02-13		Kondgen et al.	Kondgen,S.,Reiche,J.	Robert Koch Institut	A.D.5.2	GA2.3.5	0.0	good	44843	1	15225	1.0	1.0	1.0	2021.8561643835617
OR795446	OR795446.1	hRSV/A/Germany/22-01286/2021	2021-10-19	Europe	Germany			Homo sapiens	2024-02-13		Kondgen et al.	Kondgen,S.,Reiche,J.	Robert Koch Institut	A.D.1	GA2.3.5	0.0	good	44792	1	15220	0.999671592775041	1.0	1.0	2021.7986301369863
OR795445	OR795445.1	hRSV/A/Germany/22-01193/2021	2021-11-04	Europe	Germany			Homo sapiens	2024-02-13		Kondgen et al.	Kondgen,S.,Reiche,J.	Robert Koch Institut	A.D.3.1	GA2.3.5	0.0	good	44826	1	15219	0.9996059113300492	1.0	1.0	2021.8424657534247
OR795449	OR795449.1	hRSV/A/Germany/22-01311/2021	2021-11-09	Europe	Germany			Homo sapiens	2024-02-13		Kondgen et al.	Kondgen,S.,Reiche,J.	Robert Koch Institut	A.D.5.2	GA2.3.5	0.0	good	44859	1	15225	1.0	1.0	1.0	2021.8561643835617
OR795450	OR795450.1	hRSV/A/Germany/22-01320/2021	2021-11-04	Europe	Germany			Homo sapiens	2024-02-13		Kondgen et al.	Kondgen,S.,Reiche,J.	Robert Koch Institut	A.D.5.2	GA2.3.5	0.0	good	44879	1	15225	1.0	1.0	1.0	2021.8424657534247
OR795456	OR795456.1	hRSV/A/Germany/22-01933/2021	2021-11-25	Europe	Germany			Homo sapiens	2024-02-13		Kondgen et al.	Kondgen,S.,Reiche,J.	Robert Koch Institut	A.D.5	GA2.3.5	0.0	good	44787	1	15225	1.0	1.0	1.0	2021.9
OR795457	OR795457.1	hRSV/A/Germany/22-01974/2021	2021-11-22	Europe	Germany			Homo sapiens	2024-02-13		Kondgen et al.	Kondgen,S.,Reiche,J.	Robert Koch Institut	A.D.5.2	GA2.3.5	0.0	good	44551	1	15121	0.9931691297208538	1.0	1.0	2021.8917808219178
OR795455	OR795455.1	hRSV/A/Germany/22-01741/2021	2021-11-19	Europe	Germany			Homo sapiens	2024-02-13		Kondgen et al.	Kondgen,S.,Reiche,J.	Robert Koch Institut	A.D.1	GA2.3.5	0.0	good	44892	1	15219	0.9996059113300492	1.0	1.0	2021.8835616438357
OR795458	OR795458.1	hRSV/A/Germany/22-01987/2021	2021-11-24	Europe	Germany			Homo sapiens	2024-02-13		Kondgen et al.	Kondgen,S.,Reiche,J.	Robert Koch Institut	A.D.5.2	GA2.3.5	0.0	good	44899	1	15225	1.0	1.0	1.0	2021.8972602739725
OR795459	OR795459.1	hRSV/A/Germany/22-02018/2021	2021-11-26	Europe	Germany			Homo sapiens	2024-02-13		Kondgen et al.	Kondgen,S.,Reiche,J.	Robert Koch Institut	A.D.3	GA2.3.5	0.0	good	44895	1	15225	1.0	1.0	1.0	2021.9027397260274
OR795462	OR795462.1	hRSV/A/Germany/22-02048/2021	2021-11-26	Europe	Germany			Homo sapiens	2024-02-13		Kondgen et al.	Kondgen,S.,Reiche,J.	Robert Koch Institut	A.D.5	GA2.3.5	0.0	good	44759	1	15219	0.9996059113300492	1.0	1.0	2021.9027397260274
OR795467	OR795467.1	hRSV/A/Germany/22-02371/2021	2021-12-08	Europe	Germany			Homo sapiens	2024-02-13		Kondgen et al.	Kondgen,S.,Reiche,J.	Robert Koch Institut	A.D.5.2	GA2.3.5	0.0	good	44851	1	15225	1.0	1.0	1.0	2021.9356164383562
OR795466	OR795466.1	hRSV/A/Germany/22-02323/2021	2021-12-07	Europe	Germany			Homo sapiens	2024-02-13		Kondgen et al.	Kondgen,S.,Reiche,J.	Robert Koch Institut	A.D.3	GA2.3.5	0.0	good	44493	1	15081	0.9905418719211824	1.0	1.0	2021.9328767123288
OR795477	OR795477.1	hRSV/A/Germany/23-01059/2022	2022-11-15	Europe	Germany			Homo sapiens	2024-02-13		Kondgen et al.	Kondgen,S.,Reiche,J.	Robert Koch Institut	A.D.5.3	GA2.3.5	0.0	good	44854	1	15225	1.0	1.0	1.0	2022.872602739726
OR872587	OR872587.1	hRSV-A-W13J87H2	2022-07-22	North America	USA			Homo sapiens	2023-12-17		Gilbert et al.	Gilbert,J.,Lauring,A.S.,Papalambros,L.K.	University of Michigan, Microbiology & Immunology	A.D.1.8	GA2.3.5	0.0	good	42281	550	14975	0.936288998357964	1.0	1.0	2022.554794520548
OR872585	OR872585.1	hRSV-A-W13K34X1	2022-10-17	North America	USA			Homo sapiens	2023-12-17		Gilbert et al.	Gilbert,J.,Lauring,A.S.,Papalambros,L.K.	University of Michigan, Microbiology & Immunology	A.D.1.8	GA2.3.5	0.0	good	40900	854	14975	0.8836781609195402	1.0	1.0	2022.7931506849316
OR872586	OR872586.1	hRSV-A-W13J75Y8	2022-06-24	North America	USA			Homo sapiens	2023-12-17		Gilbert et al.	Gilbert,J.,Lauring,A.S.,Papalambros,L.K.	University of Michigan, Microbiology & Immunology	A.D.5.2	GA2.3.5	0.0	good	41788	550	14975	0.8972742200328407	1.0	1.0	2022.478082191781
OR872589	OR872589.1	hRSV-A-D13J37Z3	2022-10-31	North America	USA			Homo sapiens	2023-12-17		Gilbert et al.	Gilbert,J.,Lauring,A.S.,Papalambros,L.K.	University of Michigan, Microbiology & Immunology	A.D.1	GA2.3.5	0.0	good	42446	550	14975	0.943711001642036	1.0	1.0	2022.831506849315
OR872601	OR872601.1	hRSV-A-D13J36G0	2022-10-26	North America	USA			Homo sapiens	2023-12-17		Gilbert et al.	Gilbert,J.,Lauring,A.S.,Papalambros,L.K.	University of Michigan, Microbiology & Immunology	A.D.5.2	GA2.3.5	0.0	good	42153	550	14975	0.924991789819376	1.0	1.0	2022.817808219178
OR872605	OR872605.1	hRSV-A-D13J40O5	2022-10-30	North America	USA			Homo sapiens	2023-12-17		Gilbert et al.	Gilbert,J.,Lauring,A.S.,Papalambros,L.K.	University of Michigan, Microbiology & Immunology	A.D.3	GA2.3.5	0.0	good	41270	550	14975	0.8592446633825944	1.0	1.0	2022.8287671232877
OR872603	OR872603.1	hRSV-A-D13J36F4	2022-10-26	North America	USA			Homo sapiens	2023-12-17		Gilbert et al.	Gilbert,J.,Lauring,A.S.,Papalambros,L.K.	University of Michigan, Microbiology & Immunology	A.D.5.2	GA2.3.5	0.0	good	41337	653	14975	0.878752052545156	1.0	1.0	2022.817808219178
OR872617	OR872617.1	hRSV-A-W13K17K2	2022-09-22	North America	USA			Homo sapiens	2023-12-17		Gilbert et al.	Gilbert,J.,Lauring,A.S.,Papalambros,L.K.	University of Michigan, Microbiology & Immunology	A.D.5.2	GA2.3.5	0.0	good	39243	1183	14975	0.8111001642036125	1.0	1.0	2022.7246575342465
OR872622	OR872622.1	hRSV-A-W13J48E5	2022-04-27	North America	USA			Homo sapiens	2023-12-17		Gilbert et al.	Gilbert,J.,Lauring,A.S.,Papalambros,L.K.	University of Michigan, Microbiology & Immunology	A.D.1.8	GA2.3.5	1.5625	good	41953	550	14975	0.9123152709359604	1.0	1.0	2022.3191780821917
OR872619	OR872619.1	hRSV-A-W13J75Q6	2022-06-21	North America	USA			Homo sapiens	2023-12-17		Gilbert et al.	Gilbert,J.,Lauring,A.S.,Papalambros,L.K.	University of Michigan, Microbiology & Immunology	A.D.1.7	GA2.3.5	0.0	good	42171	550	14975	0.9260426929392448	1.0	1.0	2022.4698630136986
OR872636	OR872636.1	hRSV-A-W13K31L5	2022-10-11	North America	USA			Homo sapiens	2023-12-17		Gilbert et al.	Gilbert,J.,Lauring,A.S.,Papalambros,L.K.	University of Michigan, Microbiology & Immunology	A.D.3	GA2.3.5	0.0	good	40823	550	14975	0.8325123152709359	1.0	1.0	2022.7767123287672
OR882972	OR882972.1	hRSV-A-G43Q59Q3	2023-05-08	North America	USA			Homo sapiens	2023-12-17		Lauring et al.	Lauring,A.S.,Papalambros,L.K.,Fitzsimmons,W.J.,Gilbert,J.	University of Michigan, Microbiology & Immunology	A.D.3.3	GA2.3.5	0.0	good	42443	542	14976	0.9408866995073892	1.0	1.0	2023.349315068493
OR882971	OR882971.1	hRSV-A-G43Q42F6	2023-03-24	North America	USA			Homo sapiens	2023-12-17		Lauring et al.	Lauring,A.S.,Papalambros,L.K.,Fitzsimmons,W.J.,Gilbert,J.	University of Michigan, Microbiology & Immunology	A.D.5.2	GA2.3.5	0.0	good	42958	294	14976	0.9429228243021348	1.0	1.0	2023.2260273972602
OR882979	OR882979.1	hRSV-A-HS16189	2022-11-23	North America	USA			Homo sapiens	2023-12-17		Lauring et al.	Lauring,A.S.,Papalambros,L.K.,Fitzsimmons,W.J.,Gilbert,J.	University of Michigan, Microbiology & Immunology	A.D.5.2	GA2.3.5	0.0	good	42898	294	14976	0.9401642036124794	1.0	1.0	2022.8945205479451
OR882974	OR882974.1	hRSV-A-HS16195	2022-11-26	North America	USA			Homo sapiens	2023-12-17		Lauring et al.	Lauring,A.S.,Papalambros,L.K.,Fitzsimmons,W.J.,Gilbert,J.	University of Michigan, Microbiology & Immunology	A.D.1	GA2.3.5	3.737778	good	42170	548	14976	0.9305747126436782	1.0	1.0	2022.9027397260274
OR883006	OR883006.1	hRSV-A-G43Q56E3	2023-05-01	North America	USA			Homo sapiens	2023-12-17		Lauring et al.	Lauring,A.S.,Papalambros,L.K.,Fitzsimmons,W.J.,Gilbert,J.	University of Michigan, Microbiology & Immunology	A.D.5.2	GA2.3.5	1.5625	good	42349	294	14976	0.9004926108374385	1.0	1.0	2023.3301369863013
OR883001	OR883001.1	hRSV-A-HS15978	2022-10-28	North America	USA			Homo sapiens	2023-12-17		Lauring et al.	Lauring,A.S.,Papalambros,L.K.,Fitzsimmons,W.J.,Gilbert,J.	University of Michigan, Microbiology & Immunology	A.D.5.2	GA2.3.5	0.0	good	42844	294	14976	0.9342528735632184	1.0	1.0	2022.823287671233
OR883017	OR883017.1	hRSV-A-G43Q52T0	2023-04-13	North America	USA			Homo sapiens	2023-12-17		Lauring et al.	Lauring,A.S.,Papalambros,L.K.,Fitzsimmons,W.J.,Gilbert,J.	University of Michigan, Microbiology & Immunology	A.D.3	GA2.3.5	0.0	good	42543	371	14976	0.9261740558292284	1.0	1.0	2023.2808219178082
OR915729	OR915729.1	hRSV-A-HS16579	2023-01-07	North America	USA			Homo sapiens	2023-12-26		Lauring et al.	Lauring,A.S.,Papalambros,L.K.	University Of Michigan, Internal Medicine - Infectious Disease	A.D.5.2	GA2.3.5	0.0	good	42360	294	14976	0.900623973727422	1.0	1.0	2023.017808219178
OR915737	OR915737.1	hRSV-A-HCV11056	2022-10-31	North America	USA			Homo sapiens	2023-12-26		Lauring et al.	Lauring,A.S.,Papalambros,L.K.	University Of Michigan, Internal Medicine - Infectious Disease	A.D.3	GA2.3.5	0.0	good	42743	294	14976	0.926896551724138	1.0	1.0	2022.831506849315
OR915740	OR915740.1	hRSV-A-HCV11500	2022-11-10	North America	USA			Homo sapiens	2023-12-26		Lauring et al.	Lauring,A.S.,Papalambros,L.K.	University Of Michigan, Internal Medicine - Infectious Disease	A.D.5.2	GA2.3.5	0.0	good	41122	294	14700	0.8560262725779967	1.0	1.0	2022.858904109589
OR915746	OR915746.1	hRSV-A-HCV11139	2022-11-02	North America	USA			Homo sapiens	2023-12-26		Lauring et al.	Lauring,A.S.,Papalambros,L.K.	University Of Michigan, Internal Medicine - Infectious Disease	A.D.5.2	GA2.3.5	0.0	good	41978	294	14976	0.8746141215106732	1.0	1.0	2022.83698630137
OR915752	OR915752.1	hRSV-A-HCV10583	2022-10-16	North America	USA			Homo sapiens	2023-12-26		Lauring et al.	Lauring,A.S.,Papalambros,L.K.	University Of Michigan, Internal Medicine - Infectious Disease	A.D.5.2	GA2.3.5	0.0	good	40870	371	14968	0.809064039408867	1.0	1.0	2022.7904109589042
OR915762	OR915762.1	hRSV-A-HS16444	2022-12-26	North America	USA			Homo sapiens	2023-12-26		Lauring et al.	Lauring,A.S.,Papalambros,L.K.	University Of Michigan, Internal Medicine - Infectious Disease	A.D.5.2	GA2.3.5	0.0	good	42720	294	14976	0.9274220032840722	1.0	1.0	2022.9849315068493
OR915765	OR915765.1	hRSV-A-HS9760	2021-09-27	North America	USA			Homo sapiens	2023-12-26		Lauring et al.	Lauring,A.S.,Papalambros,L.K.	University Of Michigan, Internal Medicine - Infectious Disease	A.D.5.3	GA2.3.5	0.0	good	42680	294	14977	0.9214449917898194	1.0	1.0	2021.7383561643835
OR915760	OR915760.1	hRSV-A-HCV10794	2022-10-24	North America	USA			Homo sapiens	2023-12-26		Lauring et al.	Lauring,A.S.,Papalambros,L.K.	University Of Michigan, Internal Medicine - Infectious Disease	A.D.3	GA2.3.5	0.0	good	42817	294	14976	0.9317569786535304	1.0	1.0	2022.8123287671233
OR915771	OR915771.1	hRSV-A-HCV12045	2022-11-27	North America	USA			Homo sapiens	2023-12-26		Lauring et al.	Lauring,A.S.,Papalambros,L.K.	University Of Michigan, Internal Medicine - Infectious Disease	A.D.5.2	GA2.3.5	0.0	good	42849	294	14976	0.9378653530377667	1.0	1.0	2022.9054794520548
OR915770	OR915770.1	hRSV-A-HCV11629	2022-11-15	North America	USA			Homo sapiens	2023-12-26		Lauring et al.	Lauring,A.S.,Papalambros,L.K.	University Of Michigan, Internal Medicine - Infectious Disease	A.D.1.5	GA2.3.5	0.0	good	42093	548	14976	0.9223645320197044	1.0	1.0	2022.872602739726
OR915766	OR915766.1	hRSV-A-HCV12049	2022-11-27	North America	USA			Homo sapiens	2023-12-26		Lauring et al.	Lauring,A.S.,Papalambros,L.K.	University Of Michigan, Internal Medicine - Infectious Disease	A.D.5.2	GA2.3.5	0.0	good	42831	294	14976	0.935632183908046	1.0	1.0	2022.9054794520548
OR915769	OR915769.1	hRSV-A-HS9932	2021-10-04	North America	USA			Homo sapiens	2023-12-26		Lauring et al.	Lauring,A.S.,Papalambros,L.K.	University Of Michigan, Internal Medicine - Infectious Disease	A.D.5.3	GA2.3.5	0.0	good	42630	294	14976	0.9185550082101808	1.0	1.0	2021.7575342465752
OR915774	OR915774.1	hRSV-A-HS9427	2021-08-24	North America	USA			Homo sapiens	2023-12-26		Lauring et al.	Lauring,A.S.,Papalambros,L.K.	University Of Michigan, Internal Medicine - Infectious Disease	A.D.5.3	GA2.3.5	0.0	good	42936	294	14977	0.9379967159277504	1.0	1.0	2021.645205479452
OR975306	OR975306.1	RSV-A/human/USA/WA-S24228/2023	2023-09-29	North America	USA	Washington	King County WA	Homo sapiens	2024-01-09		Frazar et al.	Frazar,C.D.,Lee,J.,Ryke,E.,Gamboa,L.,McDermot,E.,Kolar,T.,Han,P.D.,Sibley,T.R.,Reinhart,D.,Grindstaff,S.,Truong,M.,Babu,T.M.,Feldstein,L.R.,Saydah,S.,Briggs-Hagen,M.,Casto,A.,Ehmen,B.,Englund,J.A.,Fortmann,S.P.,Kuntz,J.L.,Lockwood,T.,Midgley,C.M.,Mularski,R.A.,Ogilvie,T.,Reich,S.,Schmidt,M.A.,Smith,N.,Starita,L.,Stone,J.,Vandermeer,M.,Weil,A.A.,Wolf,C.R.,Chu,H.Y.,Naleway,A.L.	The Brotman Baty Institute for Precision Medicine	A.D.1.5	GA2.3.5	0.0	good	44660	25	15222	0.9973070607553366	1.0	1.0	2023.7438356164384
PP109421	PP109421.1	hRSV/A/England/397/2017	2017-10-30	Europe	United Kingdom			Homo sapiens	2024-01-28		Talts et al.	Talts,T.,Kele,B.,Hoschler,K.,Zambon,M.	UK Health Security Agency, Virus Reference Department	A.D.2.2.1	GA2.3.5	0.0	good	45675	1	15225	1.0	1.0	1.0	2017.8287671232877
PP135016	PP135016.1	MN-MDH-RSVA-00020	2023-08-30	North America	USA	Minnesota		Homo sapiens	2024-01-28	SRR27380616	Kunerth et al.	Kunerth,H.D.,Plumb,M.,Namugenyi,S.,Evans,D.,Wang,X.	Minnesota Department of Health, Public Health Laboratory - Infectious Disease Lab	A.D.5.4	GA2.3.5	0.0	good	43261	82	14940	0.9476518883415436	1.0	1.0	2023.6616438356164
PP151342	PP151342.1	KW/RSV/52155	2021-09-16	Asia	Kuwait			Homo sapiens	2024-01-31		Madi et al.	Madi,N.	Kuwait University, Microbiology	A.D.5	GA2.3.5	134.56	bad	44134	1	15225	1.0	1.0	1.0	2021.7082191780821
PP151344	PP151344.1	KW/RSVA/11262	2021-10-19	Asia	Kuwait			Homo sapiens	2024-01-31		Madi et al.	Madi,N.	Kuwait University, Microbiology	A.D.3	GA2.3.5	27.04	good	44258	1	15225	1.0	1.0	1.0	2021.7986301369863
PP151346	PP151346.1	KW/RSVA/15	2021-10-19	Asia	Kuwait			Homo sapiens	2024-01-31		Madi et al.	Madi,N.	Kuwait University, Microbiology	A	unassigned	601.884444	bad	43318	1	15225	1.0	1.0	1.0	2021.7986301369863
PP151355	PP151355.1	KW/RSVA/3657	2021-09-05	Asia	Kuwait			Homo sapiens	2024-01-31		Madi et al.	Madi,N.	Kuwait University, Microbiology	A.D.3	GA2.3.5	19.951111	good	44330	1	15225	1.0	1.0	1.0	2021.6780821917807
PP151364	PP151364.1	KW/RSVA/43736	2021-08-14	Asia	Kuwait			Homo sapiens	2024-01-31		Madi et al.	Madi,N.	Kuwait University, Microbiology	A.D.5	GA2.3.5	68.8025	mediocre	44298	1	15225	0.9999343185550084	1.0	1.0	2021.6178082191782
PP151366	PP151366.1	KW/RSVA/44196	2021-09-18	Asia	Kuwait			Homo sapiens	2024-01-31		Madi et al.	Madi,N.	Kuwait University, Microbiology	A.D.3	GA2.3.5	82.204444	mediocre	44110	1	15225	1.0	1.0	1.0	2021.713698630137
PP151375	PP151375.1	KW/RSVA/45535	2021-09-21	Asia	Kuwait			Homo sapiens	2024-01-31		Madi et al.	Madi,N.	Kuwait University, Microbiology	A.D.5	GA2.3.5	22.404444	good	44430	1	15225	1.0	1.0	1.0	2021.7219178082191
PP151369	PP151369.1	KW/RSVA/44695	2021-09-01	Asia	Kuwait			Homo sapiens	2024-01-31		Madi et al.	Madi,N.	Kuwait University, Microbiology	A.D.3	GA2.3.5	8.217778	good	44370	1	15225	1.0	1.0	1.0	2021.6671232876713
PP151374	PP151374.1	KW/RSVA/45534	2022-02-14	Asia	Kuwait			Homo sapiens	2024-01-31		Madi et al.	Madi,N.	Kuwait University, Microbiology	A.D.3	GA2.3.5	0.751111	good	44482	1	15225	1.0	1.0	1.0	2022.1219178082192
PP151376	PP151376.1	KW/RSVA/45688	2021-08-10	Asia	Kuwait			Homo sapiens	2024-01-31		Madi et al.	Madi,N.	Kuwait University, Microbiology	A.D.3	GA2.3.5	326.404444	bad	43770	1	15225	1.0	1.0	1.0	2021.6068493150685
PP151381	PP151381.1	KW/RSVA/46811	2021-09-11	Asia	Kuwait			Homo sapiens	2024-01-31		Madi et al.	Madi,N.	Kuwait University, Microbiology	A.D.3	GA2.3.5	25.671111	good	44286	1	15225	1.0	1.0	1.0	2021.694520547945
PP151380	PP151380.1	KW/RSVA/46733	2021-09-01	Asia	Kuwait			Homo sapiens	2024-01-31		Madi et al.	Madi,N.	Kuwait University, Microbiology	A.D.3	GA2.3.5	43.380278	mediocre	44226	1	15225	0.9999343185550084	1.0	1.0	2021.6671232876713
PP151378	PP151378.1	KW/RSVA/46414	2021-09-16	Asia	Kuwait			Homo sapiens	2024-01-31		Madi et al.	Madi,N.	Kuwait University, Microbiology	A.D.3	GA2.3.5	66.151111	mediocre	44186	1	15225	1.0	1.0	1.0	2021.7082191780821
PP151384	PP151384.1	KW/RSVA/47618	2021-09-10	Asia	Kuwait			Homo sapiens	2024-01-31		Madi et al.	Madi,N.	Kuwait University, Microbiology	A.D	GA2.3.5	114.41	bad	44266	1	15225	0.9998686371100164	1.0	1.0	2021.6917808219177
PP151386	PP151386.1	KW/RSVA/48464	2021-09-09	Asia	Kuwait			Homo sapiens	2024-01-31		Madi et al.	Madi,N.	Kuwait University, Microbiology	A.D.3	GA2.3.5	136.111111	bad	44006	1	15225	1.0	1.0	1.0	2021.6890410958904
PP151387	PP151387.1	KW/RSVA/49525	2021-09-07	Asia	Kuwait			Homo sapiens	2024-01-31		Madi et al.	Madi,N.	Kuwait University, Microbiology	A.D.3	GA2.3.5	56.751111	mediocre	44142	1	15225	1.0	1.0	1.0	2021.6835616438357
PP151390	PP151390.1	KW/RSVA/50956	2021-09-04	Asia	Kuwait			Homo sapiens	2024-01-31		Madi et al.	Madi,N.	Kuwait University, Microbiology	A.3.1.1	GA2.3.3	142.404444	bad	44206	1	15225	1.0	1.0	1.0	2021.6753424657534
PP151393	PP151393.1	KW/RSVA/52206	2021-08-15	Asia	Kuwait			Homo sapiens	2024-01-31		Madi et al.	Madi,N.	Kuwait University, Microbiology	A.D.5	GA2.3.5	47.151111	mediocre	44310	1	15225	1.0	1.0	1.0	2021.6205479452055
PP151399	PP151399.1	KW/RSVA/52939	2021-09-26	Asia	Kuwait			Homo sapiens	2024-01-31		Madi et al.	Madi,N.	Kuwait University, Microbiology	A.D.3.1	GA2.3.5	1.96	good	44438	1	15225	1.0	1.0	1.0	2021.7356164383561
PP151397	PP151397.1	KW/RSVA/5278	2021-10-02	Asia	Kuwait			Homo sapiens	2024-01-31		Madi et al.	Madi,N.	Kuwait University, Microbiology	A.D.3	GA2.3.5	67.24	mediocre	44154	1	15225	1.0	1.0	1.0	2021.7520547945205
PP203259	PP203259.1	PP203259	2022-XX-XX	North America	USA	Washington		Homo sapiens	2024-02-18		Goya et al.	Goya,S.,Wendm,S.,Sereewit,J.,Shankar,R.,Kim,D.Y.,Greninger,A.L.	University of Washington Dept. Laboratory Medicine and Pathology, Virology Division	A.D.2.1	GA2.3.5	0.0	good	44718	1	15225	1.0	1.0	1.0	[2022.0013698630137:2022.9986301369863]
PP203262	PP203262.1	PP203262	2022-XX-XX	North America	USA	Washington		Homo sapiens	2024-02-18		Goya et al.	Goya,S.,Wendm,S.,Sereewit,J.,Shankar,R.,Kim,D.Y.,Greninger,A.L.	University of Washington Dept. Laboratory Medicine and Pathology, Virology Division	A.D.5	GA2.3.5	1.5625	good	44560	1	15225	0.9999343185550084	1.0	1.0	[2022.0013698630137:2022.9986301369863]
PP231864	PP231864.1	NIMH/NV/RSV	2020-XX-XX	Asia	India			Homo sapiens	2024-02-19		Suran et al.	Suran,S.,Dhanya,K.,Varun,C.N.,Mani,R.S.	NIMHANS, Department of Neurovirology	A.D.3	GA2.3.5	0.0	good	43636	72	14974	0.9676847290640396	1.0	1.0	[2020.0013661202186:2020.9986338797814]
PP237780	PP237780.1	MN-MDH-RSVA-00043	2023-09-29	North America	USA	Minnesota		Homo sapiens	2024-02-19	SRR27700203	Kunerth et al.	Kunerth,H.D.,Plumb,M.,Namugenyi,S.,Evans,D.,Wang,X.	Minnesota Department of Health, Public Health Laboratory - Infectious Disease Lab	A.D.5.4	GA2.3.5	0.0	good	43473	82	15128	0.9345155993431856	1.0	1.0	2023.7438356164384
PP237783	PP237783.1	MN-MDH-RSVA-00051	2023-10-04	North America	USA	Minnesota		Homo sapiens	2024-02-19	SRR27700194	Kunerth et al.	Kunerth,H.D.,Plumb,M.,Namugenyi,S.,Evans,D.,Wang,X.	Minnesota Department of Health, Public Health Laboratory - Infectious Disease Lab	A.D.5.4	GA2.3.5	0.0	good	42731	82	14940	0.909688013136289	1.0	1.0	2023.7575342465752
PP342416	PP342416.1	RSV-A/human/USA/OR-S24676/2023	2023-11-19	North America	USA	Oregon	Multnomah County OR	Homo sapiens	2024-02-26		Frazar et al.	Frazar,C.D.,Lee,J.,Ryke,E.,Gamboa,L.,McDermot,E.,Kolar,T.,Han,P.D.,Sibley,T.R.,Reinhart,D.,Grindstaff,S.,Truong,M.,Babu,T.M.,Feldstein,L.R.,Saydah,S.,Briggs-Hagen,M.,Casto,A.,Ehmen,B.,Englund,J.A.,Fortmann,S.P.,Kuntz,J.L.,Lockwood,T.,Midgley,C.M.,Mularski,R.A.,Ogilvie,T.,Opsahl,J.,Reich,S.,Rodriguez-Salas,L.,Schmidt,M.A.,Smith,N.,Starita,L.,Stone,J.,Vandermeer,M.,Weil,A.A.,Wolf,C.R.,Chu,H.Y.,Naleway,A.L.	The Brotman Baty Institute for Precision Medicine	A.D.1.5	GA2.3.5	0.0	good	44651	26	15221	0.9954022988505749	1.0	1.0	2023.8835616438357
PP342418	PP342418.1	RSV-A/human/USA/OR-S24678/2023	2023-11-29	North America	USA	Oregon	Multnomah County OR	Homo sapiens	2024-02-26		Frazar et al.	Frazar,C.D.,Lee,J.,Ryke,E.,Gamboa,L.,McDermot,E.,Kolar,T.,Han,P.D.,Sibley,T.R.,Reinhart,D.,Grindstaff,S.,Truong,M.,Babu,T.M.,Feldstein,L.R.,Saydah,S.,Briggs-Hagen,M.,Casto,A.,Ehmen,B.,Englund,J.A.,Fortmann,S.P.,Kuntz,J.L.,Lockwood,T.,Midgley,C.M.,Mularski,R.A.,Ogilvie,T.,Opsahl,J.,Reich,S.,Rodriguez-Salas,L.,Schmidt,M.A.,Smith,N.,Starita,L.,Stone,J.,Vandermeer,M.,Weil,A.A.,Wolf,C.R.,Chu,H.Y.,Naleway,A.L.	The Brotman Baty Institute for Precision Medicine	A.D.5.2	GA2.3.5	0.0	good	44703	26	15221	0.998095238095238	1.0	1.0	2023.9109589041095
PP342420	PP342420.1	RSV-A/human/USA/WA-S24680/2023	2023-12-01	North America	USA	Washington	King County WA	Homo sapiens	2024-02-26		Frazar et al.	Frazar,C.D.,Lee,J.,Ryke,E.,Gamboa,L.,McDermot,E.,Kolar,T.,Han,P.D.,Sibley,T.R.,Reinhart,D.,Grindstaff,S.,Truong,M.,Babu,T.M.,Feldstein,L.R.,Saydah,S.,Briggs-Hagen,M.,Casto,A.,Ehmen,B.,Englund,J.A.,Fortmann,S.P.,Kuntz,J.L.,Lockwood,T.,Midgley,C.M.,Mularski,R.A.,Ogilvie,T.,Opsahl,J.,Reich,S.,Rodriguez-Salas,L.,Schmidt,M.A.,Smith,N.,Starita,L.,Stone,J.,Vandermeer,M.,Weil,A.A.,Wolf,C.R.,Chu,H.Y.,Naleway,A.L.	The Brotman Baty Institute for Precision Medicine	A.D.2.1	GA2.3.5	0.871111	good	44515	71	15221	0.9875862068965516	1.0	1.0	2023.9164383561645
PP342424	PP342424.1	RSV-A/human/USA/WA-S24684/2023	2023-12-05	North America	USA	Washington	King County WA	Homo sapiens	2024-02-26		Frazar et al.	Frazar,C.D.,Lee,J.,Ryke,E.,Gamboa,L.,McDermot,E.,Kolar,T.,Han,P.D.,Sibley,T.R.,Reinhart,D.,Grindstaff,S.,Truong,M.,Babu,T.M.,Feldstein,L.R.,Saydah,S.,Briggs-Hagen,M.,Casto,A.,Ehmen,B.,Englund,J.A.,Fortmann,S.P.,Kuntz,J.L.,Lockwood,T.,Midgley,C.M.,Mularski,R.A.,Ogilvie,T.,Opsahl,J.,Reich,S.,Rodriguez-Salas,L.,Schmidt,M.A.,Smith,N.,Starita,L.,Stone,J.,Vandermeer,M.,Weil,A.A.,Wolf,C.R.,Chu,H.Y.,Naleway,A.L.	The Brotman Baty Institute for Precision Medicine	A.D.3.3	GA2.3.5	0.0	good	44175	26	15037	0.980032840722496	1.0	1.0	2023.927397260274
PP342422	PP342422.1	RSV-A/human/USA/OR-S24682/2023	2023-12-04	North America	USA	Oregon	Clackamas County	Homo sapiens	2024-02-26		Frazar et al.	Frazar,C.D.,Lee,J.,Ryke,E.,Gamboa,L.,McDermot,E.,Kolar,T.,Han,P.D.,Sibley,T.R.,Reinhart,D.,Grindstaff,S.,Truong,M.,Babu,T.M.,Feldstein,L.R.,Saydah,S.,Briggs-Hagen,M.,Casto,A.,Ehmen,B.,Englund,J.A.,Fortmann,S.P.,Kuntz,J.L.,Lockwood,T.,Midgley,C.M.,Mularski,R.A.,Ogilvie,T.,Opsahl,J.,Reich,S.,Rodriguez-Salas,L.,Schmidt,M.A.,Smith,N.,Starita,L.,Stone,J.,Vandermeer,M.,Weil,A.A.,Wolf,C.R.,Chu,H.Y.,Naleway,A.L.	The Brotman Baty Institute for Precision Medicine	A.D.1.5	GA2.3.5	0.0	good	44668	26	15221	0.998095238095238	1.0	1.0	2023.9246575342465
